Title,Len,Content,Publishing Date
Idaho begins rationing health care as Covid surge crushes hospitals,7454,"BOISE, Idaho — Idaho public health leaders announced Tuesday that they activated “crisis standards of care” allowing health care rationing for the state’s northern hospitals because there are more coronavirus patients than the institutions can handle. The Idaho Department of Health and Welfare quietly enacted the move Monday and publicly announced it in a statement Tuesday morning — warning residents that they may not get the care they would normally expect if they need to be hospitalized. The move came as the state’s confirmed coronavirus cases skyrocketed in recent weeks. Idaho has one of the lowest vaccination rates in the U.S. The state health agency cited “a severe shortage of staffing and available beds in the northern area of the state caused by a massive increase in patients with Covid-19 who require hospitalization.” The designation includes 10 hospitals and healthcare systems in the Idaho panhandle and in north-central Idaho. The agency said its goal is to extend care to as many patients as possible and to save as many lives as possible. The move allows hospitals to allot scarce resources like intensive care unit rooms to patients most likely to survive and make other dramatic changes to the way they treat patients. Other patients will still receive care, but they may be placed in hospital classrooms or conference rooms rather than traditional hospital rooms or go without some life-saving medical equipment. At Kootenai Health — the largest hospital in northern Idaho — some patients are waiting for long periods for beds to open up in the full intensive care unit, said Dr. Robert Scoggins, the chief of staff. Inside the ICU, one critical care nurse might be supervising up to six patients with the help of two other non-critical care nurses. That’s a big departure from the usual one ICU nurse for one ICU patient ratio, he said. On Monday, the Coeur d’Alene hospital started moving some coronavirus patients into its nearby conference center. A large classroom in the center was converted into a Covid-19 ward, with temporary dividers separating the beds. Some emergency room patients are being treated in a converted portion of the emergency room lobby, and the hospital’s entire third floor has also been designated for coronavirus patients. Urgent and elective surgeries are on hold, Scoggins said, and Kootenai Health is struggling to accept any of the high-level trauma patients that would normally be transferred from the smaller hospitals in the region. Other states are preparing to take similar measures if needed. Hawaii Gov. David Ige quietly signed an order last week releasing hospitals and health care workers from liability if they have to ration health care. The unfolding crush of patients to Idaho hospitals has been anticipated with dread by the state’s heath care providers. Medical experts have said that Idaho could have as many as 30,000 new coronavirus cases a week by mid-September if the current rate of infections lasts. “Crisis standards of care is a last resort. It means we have exhausted our resources to the point that our healthcare systems are unable to provide the treatment and care we expect,” Idaho Department of Health and Welfare Director Dave Jeppesen said in a statement. He added: “This is a decision I was fervently hoping to avoid. The best tools we have to turn this around is for more people to get vaccinated and to wear masks indoors and in outdoor crowded public places. Please choose to get vaccinated as soon as possible – it is your very best protection against being hospitalized from Covid-19.” The designation will remain in effect until there are enough resources — including staffing, hospital beds and equipment or a drop in the number of patients — to provide normal levels of treatment to all. More than 500 people were hospitalized statewide with COVID-19 on Sept. 1 and more than a third of them were in intensive care unit beds. Idaho’s hospitals have struggled to fill empty nursing, housekeeping and other health care positions, in part because some staffers have left because they are burned out by the strain of the pandemic and because others have been quarantined because they were exposed to Covid-19. Late last month, Little called in 220 medical workers available through federal programs and mobilized 150 Idaho National Guard soldiers to help hospitals cope with the surge. Two hundred of the federal workers are medical and administrative staffers available through a contract with the U.S. General Services Administration. The U.S. Department of Defense agreed to send a 20-person medical response team to northern Idaho. The Idaho National Guard soldiers will help with logistical support such as screenings and lab work. On Tuesday, the governor called the move to limit care “an unprecedented and unwanted point in the history of our state” and urged residents to get vaccinated against coronavirus. Data from the U.S. Centers for Disease Control and Prevention shows that full vaccination with any of the currently available coronavirus vaccines dramatically reduces the risk of requiring hospitalization for a coronavirus infection. “More Idahoans need to choose to receive the vaccine so we can minimize the spread of the disease and reduce the number of Covid-19 hospitalizations, many of which involve younger Idahoans and are preventable with safe and effective vaccines,” said Little, who is a Republican. When the pandemic first came to Idaho at the start of 2020, Little ordered a partial shutdown of the state — ordering some businesses to temporarily close or shift to take-out style services, banning some large gatherings and asking residents to stay home as much as possible. The move was aimed at ensuring that hospitals wouldn’t become overwhelmed by patients. Idaho was on the verge of enacting crisis standards of care during a major coronavirus surge last winter, but narrowly avoided doing so — making this the first time the state has taken the drastic measure. Little reopened the state in stages over a period of several months and has not reimposed restrictions limiting gatherings. Businesses are mostly operating as normal. The state’s crisis guidelines are complex, and give hospitals a legal and ethical template to use while rationing care. Under the guidelines, patients are given priority scores based on a number of factors that impact their likelihood of surviving a health crisis. Those deemed in most in need of care and most likely to benefit from it are put on priority lists for scarce resources like ICU beds. Others in dire need but with lower chances of surviving will be given “comfort care” to help keep them pain-free whether they succumb to their illnesses or recover. Other patients with serious but not life-threatening medical problems will face delays in receiving care until resources are available. “I hope that your takeaway from this is that the vaccines work. They are the best tool by far that we have,” to keep people from getting seriously sick from the coronavirus, said Jeppesen, the state health department director. The demand on hospitals is likely to increase in coming weeks as case numbers continue to climb, Jeppesen said, so everyone should take steps to avoid needing any emergency care if possible by wearing seatbelts, taking medication as prescribed and reconsidering activities like riding bikes that can lead to accidents. “Just be a little more careful,” he said.","Sept. 8, 2021"
How two Americans fared with the German health care system,6193,"Americans are divided about how to pay for medical care and insurance, an issue that will continue to be debated hotly as presidential candidates tout their plans for overhauling the nation’s health care industry. Whether the “fix” is found in the Affordable Care Act, private insurance, ""Medicare for all"" or something totally different, some Americans are pointing to health care systems in other wealthy countries as models. One such country is Germany. Courtney Reich, 28, was diagnosed with Type 1 diabetes in 2009. Even though she was on her family’s health insurance at the time, she said she had to pay hundreds of dollars every month for her insulin, which was necessary for her survival. But when the Chicago native moved to Germany, Reich said she was shocked to learn both her insulin and insulin pump were totally covered — no out-of-pocket expenses. “As a student at a public university in Germany, I automatically qualified for the public health care system,” Reich said. “I was really surprised that everything necessary to take care of my diabetes was covered, 100 percent.” Reich said she couldn’t help feeling like a drain on the country’s system, and expressed those feelings to her German friends. They reassured her they simply viewed health care differently. “It’s about having a safety net, because tomorrow you don’t know what could happen,” Reich told NBC News. Six years later — still living in Germany — Reich has embraced the idea of a safety net. “I don’t need to worry about crazy stuff coming up month to month. I’d rather be paying a steady fee and knowing I’m safe,” she said. Germany has what's called a universal multi-payer health care system. It encompasses both statutory health insurance for people who earn less than a certain salary, as well as private health insurance for those who earn more and choose to purchase their own. Employers and their employees pay for most of the health care system in Germany through premiums. All workers contribute about 7.5 percent of their salary into a public health insurance pool. Employers match that 7.5 percent contribution. This “all for one and one for all” approach to health care has roots in the Middle Ages, when German craftsmen paid into one fund that was used to help any of its members in case someone became ill or suffered financial hardship. The ideology lives on in the modern German system. Everyone covered by statutory insurance has an equal right to medical care. “We are one big community,” said Dr. Henning Baberg, a cardiologist and the medical director of Helios Hospital Berlin-Buch. “The ones who are able to pay more, pay more. And the ones who aren’t able to pay that much, don’t pay that much.” “But they all get the same treatment,” he added. Baberg likens the difference between statutory and private health insurance in Germany to the difference between economy and business class on a commercial airline flight. Same flight, same plane, same safety profile. And the system imposes strict limits on out-of-pocket costs, greatly reducing the number of surprise medical bills. The maximum copay for prescription medications is about $10 or $11. Helene and Michael Sula, both originally from Dallas, are also expatriates like Reich. Unlike Reich, however, they pay for private health insurance. The Sulas chose to live in Germany for its central European location, and were taking advantage of the country’s proximity to the Austrian Alps when Helene tore her anterior cruciate ligament, or ACL, while skiing. “When I fell, I didn’t think it was that bad,” Helene Sula, 32, recalled. “It wasn’t until a man came up to me and said, ‘We’re going to need to turn your leg back the other way’ that I realized something bad had occurred.” The couple said Helene Sula was lucky to find a doctor who could do an MRI quickly once back in Germany; most places they called were booked for weeks — a common disadvantage for elective procedures. They credited their private health insurance not only with getting a swift diagnosis, but also insisting on having the best surgeon available to do the operation necessary to repair her injured knee. “There’s a price difference, of course, but it’s your knee, so we thought we’d spend a little extra cash to get the best doctor available,” Michael Sula said. The cost for everything related to Helene Sula’s knee surgery was about $2,000, compared with $14,000 for the same treatment in America. Despite some language barriers, the Sulas said the German health care system was easy to navigate. “It’s much easier to pay your bills and understand your coverage than in America, where you’re sort of left to figure it out on your own,” Michael Sula said. Health care industry experts in the United States say the German system is a good example of an employer-based model of medical insurance. “No one pays more than two percent of their family income for out-of-pocket health care costs” in Germany, said Robin Osborn, director of the International Health Policy and Practice Innovations program at The Commonwealth Fund. “And if you’re sick, if you’re chronically ill, it’s one percent. No one goes bankrupt in Germany because of medical care costs,” she said. But Osborn does not recommend the U.S. copy Germany’s or any other country’s health care system and adopt it here. “It’s important to remember that we do have outstanding health care in the United States. We have pockets of excellence. We have integrated delivery systems that are the envy of the world,” she said. “It’s just that not everyone gets that outstanding health care. It doesn’t exist uniformly across the country,” she added. Baberg, who received medical training at the University of California, San Diego, said one advantage the U.S. health care system has is transparency. Although Germans can go to any hospital they want, it’s more difficult for them to find data on quality outcomes for individual facilities. But, he added, the U.S. health care system is flawed in a different way: Americans with less money get less health care. “That’s wrong,” Baberg said. “That’s not humanity. And humanity should be a big part of medicine.” FOLLOW NBC HEALTH ON TWITTER & FACEBOOK","July 1, 2019"
"Only 6 able to sign up on healthcare.gov's first day, documents show",3114,"Only six people were able to enroll for health insurance through the Obamacare website on the first day, according to documents released Thursday by Republicans on the House Oversight and Government Reform Committee. The documents also show that by the end of the day Oct. 2, only 248 enrollments had been completed through healthcare.gov. According to notes from a meeting on the morning of Oct. 2, there was a laundry list of ""ongoing issues"" with healthcare.gov, including ""high capacity on the website, direct enrollment not working, VA system not connecting, Experian creating confusion with credit check information.""   An aide for the Oversight Committee said the notes were taken during ""War Room"" meetings at the Center for Consumer Information and Insurance, part of the Center for Medicare and Medicaid Services, which is implementing Obamacare. According to the aide, the meetings included administration officials and contractors discussing the standing issues and problems with the website’s launch. The documents only span two days: Oct. 2 and 3. The six enrollments that had been completed by the morning of Oct. 2 were spread across Blue Cross Blue Shield North Carolina, Blue Cross Blue Shield Kansas City, CareSource and Healthcare Service Corp., the documents say. Notes from an Oct. 2 ""PM"" meeting say that that ""direct enrollment is still not working,"" and ""consumer access issues are occurring; some estimates show 40,000 people in the waiting room."" At the time of that report approximately 100 enrollments had been completed. Notes from a meeting on the morning of Oct. 3 said that by then 248 enrollments had been completed. Administration officials have said that early enrollment numbers would be very low. ""These appear to be notes, they do not include official enrollment statistics,"" HHS spokeswoman Joanne Peters said in an email in response to a request for comment. ""We will release enrollment statistics on a monthly basis after coordinating information from different sources, such as paper, on-line, and call centers, verifying with insurers, and collecting data from states. ""As the secretary said before Congress, we are focused on providing reliable and accurate information and we do not have that at this time ... We have always anticipated that the pace of enrollment will increase throughout the enrollment period.""  She pointed to the experience of Massachusetts, which launched a statewide health insurance program. In the first month of open enrollment in 2007, only 123 people signed up for coverage, but by the second month that number was 2,289, and eventually more than 36,000 signed up in the first year. The launch of healthcare.gov has been riddled with problems of functionality and reliability that initially prevented many people from registering for accounts, much less signing up for insurance. HHS Secretary Kathleen Sebelius has acknowledged the problems and an outside task force of tech gurus has been brought in to help fix the flaws. Frank Thorp is an NBC News Capitol Hill producer. NBC News' Maggie Fox and Gil Aegerter contributed to this report.","Nov. 1, 2013"
Why is health care so expensive in the United States?,6257,"These days, all it takes is one surprise medical bill to send a patient into bankruptcy. The United States' health care system operates differently from many others in the world with high costs for the individual as a main, distinguishing characteristic. In fact, the higher prices mean the U.S. spends more on health care than other ""developed countries,"" a 2019 Johns Hopkins report found. What's more, almost one in three Americans worries about affording health care, according to a February 2020 survey from NBC News. (In June, a man who was hospitalized with Covid-19 for 62 days received a $1.1 million medical bill.) So, what exactly makes health care in the U.S. so expensive? Health insurance prices? Government regulation — or lack thereof? The pharmaceutical industry? TMRW talked to experts on different aspects of the health care system who pointed to five overall reasons. The most salient reason is that U.S. health care is based on a ""for-profit insurance system,"" one of the only ones in the world, according to Carmen Balber, executive director of Consumer Watchdog, who's advocated for reform in the health-insurance market. In the U.S., most health insurance is administered by private companies and individuals must pay for it themselves, even if their employer subsidizes some of it. In contrast, ""lots of other countries have some element of private something, but there is that baseline understanding that health care is a right, not a privilege,"" Balber said. The underlying motive to make money has a ripple effect that increases prices, she continued. For example, insurance companies spend an ""enormous amount of money on utilization review,"" the process that determines whether a medical service is covered under a given plan, adding that the goal is ""to not pay consumers for the care they thought they were insured for."" Similarly, Dr. Georges Benjamin, executive director of the American Public Health Association, pointed to a lack of universal health care, where everyone is guaranteed access without undergoing financial hardship, as a primary reason for high costs. ""Part of our system is that everybody is ... paying for somebody else's underpayment, whether they like it or not,"" he said. ""Everybody is trying to figure out who else can pay for it instead of them."" Benjamin blamed the complex and fragmented structure of U.S. health care — from billing to care delivery — which can unnecessarily prolong administrative processes and increase overhead. A recent study found that in 2017, administrative costs made up 34.2% of health care costs in the U.S., twice the percentage in Canada, which has a decentralized, publicly funded system. Another example: Medicare, the country's national health insurance program for Americans 65 and older, has much lower administrative costs, between 1.1 and 7%. ""Medicare ... is drastically cheaper, because we don't spend a lot of time trying to deny people the care they need,"" Balber said. ""There's not as much dedicated to the bureaucracy of health care as there is in private systems."" U.S. health care exists in a system where patients are charged based on the services they receive, yet another reason why ""almost everything is more expensive here,"" Dr. Harlan Krumholz, cardiologist and professor of health policy at Yale School of Medicine, told TMRW. ""We have higher utilization of a lot of different services,"" he explained. ""In many parts of the health care ecosystem, people are paid for volume, and so that fuels an orientation toward, 'We might as well get an extra scan.' ... It's in the economic interest of the hospital, the physician, the health care system when they're being paid fee-for service, and the justification is that more is better."" As a result, there's lower use of primary care, Benjamin said, because the fee-for-service model ""encourages overutilization."" ""Instead of taking people in a room, examining them, taking the history and spending the time talking to patients, we ... do all the complicated stuff,"" he added. ""We're quick to jump to getting the CAT scan and diagnostic test when a history and physical exam would tell you the answer."" Balber argued that fee-for-service creates a ""perverse incentive"" to provide more procedures, instead of helping patients get healthier so that the nation as a whole needs fewer procedures. The U.S. also spends less than other countries on social support systems and long-term care, Benjamin added. This is perhaps the most challenging reason to disentangle, but the main idea is this: The companies that provide and charge for health care, like hospital systems and drug makers, have more power to keep costs high when they're negotiating with multiple potential payers, like various private insurance companies. But when they must negotiate with a single payer, like the federal government, there's more pressure to meet the demand in order to sell their services. For example, a recent study found that private insurance companies paid almost two and a half times what Medicare would've paid for the same medical service at the same facility. To make matters more costly, the U.S. government doesn't regulate what most companies in the health care space can charge for their services, whether it's insurance, drugs or care itself. While the U.S. health care system itself may be fragmented, in many parts of the country, there's only one or two companies providing health insurance or medical care. This means that, again, there's little to no incentive for them to lower costs since patients don't have much of a choice. ""We keep approving more and more mergers that raise costs significantly,"" Balber said. ""Then those hospitals buy up all of the private physicians ... and then profit motive is streamlined all the way down to your primary-care doctor."" What's more, health care providers are paid, on average, much more in the U.S. than in other countries, both Benjamin and Krumholz stressed. ""Despite the enormous cost that we have in America for health care, we don't get the same value of our health care dollar as other nations do,"" Benjamin added. ""If you get sick, this is the place to be, no doubt about that, but ... we don't have a system with everybody in and nobody out."" Related:","Sept. 22, 2020"
