Title,Publishing Date,Source
"Check your fit on that double mask if you want it to work against Covid, study says","Apr 17, 2021",https://www.cnn.com/2021/04/16/health/double-mask-fit-covid-wellness/index.html
How to help siblings get along better,"Apr 10, 2021",https://www.cnn.com/2021/04/10/health/help-siblings-get-along-better-wellness/index.html
Teens slept 45 minutes more a night when their school district tried a new scheduling strategy,"Apr 15, 2021",https://www.cnn.com/2021/04/15/health/school-start-time-sleep-study-wellness/index.html
Taylor Swift surprises nurse with handwritten note,"Apr 16, 2021",https://www.cnn.com/videos/health/2021/04/16/taylor-swift-surprises-nurse-with-gifts-orig-bdk.cnn
'Medical marvel': Mom got pregnant while already pregnant,"Apr 16, 2021",https://www.cnn.com/videos/health/2021/04/16/british-mom-pregnant-while-already-pregnant-cohen-pkg-newday-vpx.cnn
"Covid-19 surge in Michigan is putting some hospitals at critical capacity levels, health care provider says","Apr 15, 2021",https://www.cnn.com/2021/04/15/health/us-coronavirus-thursday/index.html
Don't freak out if you get these side effects from a Covid-19 vaccine. They can actually be a good sign,"Apr 1, 2021",https://www.cnn.com/2021/04/01/health/covid-vaccine-side-effects/index.html
"So far, 5,800 fully vaccinated people have caught Covid anyway in US, CDC says","Apr 15, 2021",https://www.cnn.com/2021/04/14/health/breakthrough-infections-covid-vaccines-cdc/index.html
"What to make of the Johnson & Johnson vaccine pause? Dr. Wen, who got J&J herself, says not to worry","Apr 15, 2021",https://www.cnn.com/2021/04/15/health/johnson-and-johnson-vaccine-concerns-wellness/index.html
NIH director says J&J vaccine pause will give researchers time to do more study on certain groups,"Apr 14, 2021",https://www.cnn.com/2021/04/14/health/us-coronavirus-wednesday/index.html
CDC vaccine advisers put off decision on Johnson & Johnson Covid-19 vaccine,"Apr 15, 2021",https://www.cnn.com/2021/04/14/health/johnson-vaccine-cdc-acip-clots/index.html
"If you've recently had the J&J vaccine, watch for these rare symptoms, CDC says","Apr 14, 2021",https://www.cnn.com/2021/04/13/health/blood-clots-johnson--johnson-vaccine-wellness/index.html
CNN analyst calls out Nate Silver over his vaccine tweet,"Apr 14, 2021",https://www.cnn.com/videos/health/2021/04/14/nate-silver-gounder-johnson-johnson-vaccine-vpx.cnn
"Keeping middle seats vacant on airplanes can reduce risk of Covid-19 exposure by up to 57%, CDC study says","Apr 14, 2021",https://www.cnn.com/2021/04/14/health/airplane-seating-covid-risk-cdc-study-wellness/index.html
These unlikely events are still more likely than a blood clot after the J&J vaccine,"Apr 14, 2021",https://www.cnn.com/videos/health/2021/04/14/reality-check-johnson--johnson-vaccine-pause-covid-19-avlon-newday-vpx.cnn
Dr. Fauci on Tucker Carlson's comment: Typical crazy conspiracy theory,"Apr 14, 2021",https://www.cnn.com/videos/health/2021/04/14/dr-anthony-fauci-tucker-carlson-covid-19-vaccines-newday-vpx.cnn
States scramble to halt Johnson & Johnson vaccinations after CDC and FDA recommend pause,"Apr 13, 2021",https://www.cnn.com/2021/04/13/health/us-coronavirus-tuesday/index.html
"Reduce risk of severe Covid with regular activity, study says. Here's how to get in 22 minutes of exercise daily","Apr 14, 2021",https://www.cnn.com/2021/04/13/health/physical-activity-reduces-severe-covid-wellness/index.html
CDC and FDA recommend US pause use of Johnson & Johnson's Covid-19 vaccine over blood clot concerns,"Apr 13, 2021",https://www.cnn.com/2021/04/13/health/johnson-vaccine-pause-cdc-fda/index.html
Which human screams affect us most? The answer might surprise you,"Apr 14, 2021",https://www.cnn.com/2021/04/13/health/human-scream-study-wellness/index.html
Here's the impact the Johnson & Johnson pause might have on the Covid-19 vaccine rollout,"Apr 14, 2021",https://www.cnn.com/2021/04/13/health/jj-pause-covid-19-rollout/index.html
Would-be recipient of Johnson & Johnson vaccine reacts to pause,"Apr 14, 2021",https://www.cnn.com/videos/health/2021/04/13/coronavirus-vaccine-johnson-johnson-field-wrap-lead-vpx.cnn
Children's healthiest meals of the day come from school cafeterias,"Apr 13, 2021",https://www.cnn.com/2021/04/13/health/healthy-school-food-nutrition-wellness/index.html
How the US hit its vaccine stride,"Apr 13, 2021",https://www.cnn.com/2021/04/12/health/how-the-us-hit-its-vaccine-stride/index.html
Fauci says we can't end mitigation measures now even with impressive vaccine rollout,"Apr 12, 2021",https://www.cnn.com/2021/04/12/health/us-coronavirus-monday/index.html
"B.1.1.7 variant more transmissible but does not increase disease severity, two new studies suggest","Apr 13, 2021",https://www.cnn.com/2021/04/12/health/b117-variant-covid-19-lancet-studies/index.html
Fauci talks about what he is comfortable doing now that he's fully vaccinated,"Apr 13, 2021",https://www.cnn.com/videos/health/2021/04/12/dr-anthony-fauci-going-out-vaccinated-tsr-vpx.cnn
"CDC studies find racial and ethnic disparities in Covid-19 hospitalizations, ER visits","Apr 13, 2021",https://www.cnn.com/2021/04/12/health/disparities-covid-hospitalization-emergency-departments/index.html
Half of US adults expected to have at least 1 vaccine dose by next week,"Apr 13, 2021",https://www.cnn.com/videos/health/2021/04/12/gupta-us-coronavirus-vaccine-rollout-dnt-lead-vpx.cnn
How to make your gym workout less risky during the pandemic,"Apr 12, 2021",https://www.cnn.com/2021/04/12/health/gym-safety-pandemic-wellness/index.html
Regeneron says its Covid-19 antibody cocktail helps prevent symptomatic Covid-19,"Apr 12, 2021",https://www.cnn.com/2021/04/12/health/regeneron-antibody-cocktail-covid-prevention/index.html
'Michigan needs to be shut down': Doctor on Covid-19 surge,"Apr 12, 2021",https://www.cnn.com/videos/health/2021/04/11/reiner-coronavirus-surge-michigan-texas-governor-herd-immunity-nr-vpx.cnn
"As vaccinations keep rising, so do Covid-19 hospitalizations among those who aren't vaccinated","Apr 11, 2021",https://www.cnn.com/2021/04/11/health/us-coronavirus-sunday/index.html
When should you get the vaccine if you have had Covid-19? Dr. Wen explains,"Apr 11, 2021",https://www.cnn.com/2021/04/11/health/second-dose-coronavirus-vaccine-wellness/index.html
"More than half of rural residents have received a Covid-19 vaccine or plan to, but hesitancy remains high, analysis finds","Apr 9, 2021",https://www.cnn.com/2021/04/09/health/vaccine-uptake-rural-communities/index.html
Health advocates go door-to-door to fight vaccine hesitancy,"Apr 11, 2021",https://www.cnn.com/videos/health/2021/04/11/jason-carroll-vaccine-hesitancy-maine-pkg-ac360-vpx.cnn
"Losing a long-term spouse can be deadly, studies show","Apr 11, 2021",https://www.cnn.com/2021/04/11/health/widowhood-effect-queen-elizabeth-wellness/index.html
Michigan sees alarming uptick in Covid-19 cases,"Apr 11, 2021",https://www.cnn.com/videos/health/2021/04/11/michigan-rise-coronavirus-cases-mcmorris-santoro-dnt-ndwknd-vpx.cnn
"For many sufferers of long Covid, proving they are sick is a big part of the battle","Apr 11, 2021",https://www.cnn.com/2021/04/11/health/coronavirus-long-covid-intl/index.html
"Wearing masks could save at least 14,000 people from Covid-19 deaths by August, model predicts","Apr 10, 2021",https://www.cnn.com/2021/04/10/health/us-coronavirus-saturday/index.html
Dr. Sanjay Gupta looks into the origins of vaccine hesitancy,"Apr 9, 2021",https://www.cnn.com/videos/health/2021/04/09/gupta-vaccine-hesitancy-origins-newday-vpx.cnn
This event in Florida is requiring proof of vaccination,"Apr 10, 2021",https://www.cnn.com/videos/health/2021/04/10/south-beach-wine-and-food-festival-coronavirus-vaccine-ndwknd-blackwell-vpx.cnn
"The Covid-19 vaccines are highly effective, and the chance of an adverse reaction is rare","Apr 10, 2021",https://www.cnn.com/2021/04/09/health/covid-vaccines-adverse-reaction-rare-trnd/index.html
"FDA will evaluate Pfizer's request to allow Covid-19 vaccine for children ages 12-15 'as quickly as possible,' acting commissioner says","Apr 9, 2021",https://www.cnn.com/2021/04/09/health/us-coronavirus-friday/index.html
"As the US races to vaccinate the country, J&J vaccine distribution will slow down 84% next week","Apr 10, 2021",https://www.cnn.com/2021/04/09/health/jj-vaccine-slowdown/index.html
Why this new rapid coronavirus test could be a game-changer,"Aug 28, 2020",https://www.cnn.com/videos/health/2020/08/28/rapid-coronavirus-test-sanjay-gupta-pkg-nr-vpx.cnn
Government vaccine advisers say they don't foresee AstraZeneca vaccine being used in the US,"Apr 9, 2021",https://www.cnn.com/2021/04/09/health/vaccine-advisers-astrazeneca-us/index.html
These people thrived in pandemic isolation -- and aren't ready to return to 'normal' socializing,"Apr 9, 2021",https://www.cnn.com/2021/04/09/health/social-anxiety-post-pandemic-life/index.html
AstraZeneca Covid-19 vaccine: How common are blood clots and should I be worried?,"Apr 8, 2021",https://www.cnn.com/2021/04/08/health/astrazeneca-covid-vaccine-blood-clots-explainer-cmd-gbr-intl/index.html
Fauci says new Covid-19 cases are at a disturbing level as the US is primed for a surge,"Apr 8, 2021",https://www.cnn.com/2021/04/08/health/us-coronavirus-thursday/index.html
CDC: Children's team sports likely cause for spread,"Apr 9, 2021",https://www.cnn.com/videos/health/2021/04/08/coronavirus-pandemic-wrap-cdc-surge-children-spread-field-dnt-lead-vpx.cnn
Some Covid-19 long haulers say vaccines may be relieving their symptoms. Researchers are looking into it,"Apr 3, 2021",https://www.cnn.com/2021/04/03/health/long-haulers-vaccine-wellness/index.html
Covid-19 long hauler describes relief after getting vaccine,"Apr 9, 2021",https://www.cnn.com/videos/health/2021/04/08/covid-long-haulers-vaccine-cohen-dnt-vpx.cnn
A conundrum for hospitals: How to vaccinate their sick patients against Covid-19,"Apr 8, 2021",https://www.cnn.com/2021/04/08/health/vaccinating-hospitalized-patients-covid-19-wellness/index.html
How parents make the workplace better for everyone,"Apr 8, 2021",https://www.cnn.com/2021/04/08/health/parents-workforce-overwork-culture-wellness/index.html
Fauci: Almost a race between vaccinations and the surge,"Apr 8, 2021",https://www.cnn.com/videos/health/2021/04/08/anthony-fauci-race-between-vaccine-and-surge-sot-ac360-vpx.cnn
"A year of trauma: More than 3,600 US health workers died in Covid's first 12 months","Apr 8, 2021",https://www.cnn.com/2021/04/07/health/health-workers-die-covid-kaiser/index.html
"Youth sports and other extracurriculars are spreading Covid-19, health officials say","Apr 7, 2021",https://www.cnn.com/2021/04/06/health/youth-sports-covid-spread-wellness/index.html
"EU agency finds AstraZeneca vaccine can cause rare blood clots, as UK advises other shots for under-30s","Apr 7, 2021",https://www.cnn.com/2021/04/07/health/astrazeneca-coronavirus-vaccine-europe-uk-ema-intl/index.html
Five states account for 43% of the country's new Covid-19 cases in the past week,"Apr 7, 2021",https://www.cnn.com/2021/04/07/health/us-coronavirus-wednesday/index.html
EU agency finds AstraZeneca vaccine can cause rare blood clots,"Apr 8, 2021",https://www.cnn.com/videos/health/2021/04/08/astrazeneca-coronavirus-vaccine-blood-clots-uk-sot-vpx.cnn
"In the race to vaccinate against Covid-19, willing adults in some states may be waiting all year","Apr 7, 2021",https://www.cnn.com/2021/04/06/health/vaccine-timeline-states-analysis/index.html
UK variant now most dominant strain in US,"Apr 8, 2021",https://www.cnn.com/videos/health/2021/04/07/coronavirus-wrap-vaccines-variants-watt-lead-vpx.cnn
Can your unvaccinated children visit family indoors? What you should know,"Apr 7, 2021",https://www.cnn.com/2021/04/07/health/visiting-family-indoors-safety-pandemic-wellness/index.html
CDC director: UK variant is now dominant Covid-19 strain in US,"Apr 7, 2021",https://www.cnn.com/videos/health/2021/04/07/walensky-covid-19-uk-variant-sot-cohen-nr-vpx.cnn
Dr. Fauci weighs in on the risk of flying,"Apr 7, 2021",https://www.cnn.com/videos/health/2021/04/07/dr-fauci-flying-coronavirus-pandemic-vaccines-mxp-vpx.hln
A New York woman is looking forward to the future with her family after receiving the first trachea transplant,"Apr 7, 2021",https://www.cnn.com/2021/04/06/health/trachea-transplant-trnd/index.html
World Health Day: 5 things the pandemic has revealed about well-being,"Apr 7, 2021",https://www.cnn.com/2021/04/07/health/world-health-day-2021-pandemic-wellness/index.html
"A third of Covid-19 survivors suffer 'brain disease,' study shows","Apr 7, 2021",https://www.cnn.com/2021/04/06/health/covid-neurological-psychological-lancet-wellness/index.html
"California says it will fully reopen in June, citing falling Covid-19 case rates","Apr 6, 2021",https://www.cnn.com/2021/04/06/health/us-coronavirus-tuesday/index.html
Would a delayed second dose of the Covid-19 vaccine end the pandemic sooner?,"Apr 7, 2021",https://www.cnn.com/2021/04/06/health/delayed-second-dose-debate/index.html
California to fully reopen in June amid falling Covid-19 cases,"Apr 7, 2021",https://www.cnn.com/videos/health/2021/04/06/california-to-fully-reopen-coronavirus-sot-vpx-tsr.cnn
Why young people are not safe from Covid-19 — Dr. Wen explains,"Apr 7, 2021",https://www.cnn.com/2021/04/06/health/young-people-covid-cases-rising-wellness/index.html
"Black adults report bias in health care at higher rates than White and Latino people, study finds","Apr 7, 2021",https://www.cnn.com/2021/04/06/health/black-adults-health-care-discrimination/index.html
Everything old is new again: Repurposing drugs to treat Covid-19,"Feb 27, 2021",https://www.cnn.com/2021/02/27/health/covid-19-drug-repurposing-gupta/index.html
First successful trachea transplant patient thriving,"Apr 7, 2021",https://www.cnn.com/videos/health/2021/04/06/trachea-transplant-sonia-sein-orig-bdk.cnn
How to talk about alcohol and drugs with kids of all ages,"Apr 6, 2021",https://www.cnn.com/2021/04/06/health/kids-alcohol-drugs-talk-wellness/index.html
What scattered vaccination records mean for Covid-19 immunity 'passports',"Apr 6, 2021",https://www.cnn.com/2021/04/06/health/vaccine-passport-immunization-registry-data/index.html
"Another US Covid-19 surge may look different, experts say, particularly for younger people. Here's how","Apr 5, 2021",https://www.cnn.com/2021/04/05/health/us-coronavirus-monday/index.html
'People are dying': Emotional nurse on Michigan coronavirus surge,"Apr 6, 2021",https://www.cnn.com/videos/health/2021/04/06/michigan-hospital-covid-19-variants-marquez-pkg-ac360-vpx.cnn
All 50 states now have expanded or will expand Covid vaccine eligibility to everyone 16 and up,"Mar 31, 2021",https://www.cnn.com/2021/03/30/health/states-covid-19-vaccine-eligibility-bn/index.html
Experts divided over if US will see true fourth wave of Covid-19,"Apr 6, 2021",https://www.cnn.com/videos/health/2021/04/05/health-experts-fourth-wave-coronavirus-wrap-field-pkg-lead-vpx.cnn
"""Staggering"" number of children have lost at least one parent to Covid-19, model estimates","Apr 5, 2021",https://www.cnn.com/2021/04/05/health/parental-deaths-covid-19-wellness/index.html
"Illinois bar opening event linked to 46 Covid-19 cases, a school closure and hospitalization, CDC report says","Apr 5, 2021",https://www.cnn.com/2021/04/05/health/illinois-bar-covid-cases/index.html
Doctor: Here's what I say to people who want to 'wait and see' before getting vaccine,"Apr 5, 2021",https://www.cnn.com/videos/health/2021/04/05/doctor-message-to-those-who-want-to-wait-and-see-before-getting-covid-19-vaccine-hesitancy-camerota-newday-vpx.cnn
Health experts sound alarm as Covid-19 cases surge,"Apr 5, 2021",https://www.cnn.com/videos/health/2021/04/05/covid-19-possible-fourth-wave-sandoval-pkg-newday-vpx.cnn
'Then' is still 'now': Author Mary-Frances Winters weighs in on the high costs of living while Black in US,"Apr 5, 2021",https://www.cnn.com/2021/04/05/health/black-fatigue-mary-frances-winters-wellness/index.html
Factors this doctor wants you to think about Easter weekend,"Apr 2, 2021",https://www.cnn.com/videos/health/2021/04/02/dr-ebony-hilton-coronavirus-easter-weekend-nr-vpx.cnn
Researchers tested 14 types of masks. Here's what they learned (2020),"Nov 12, 2020",https://www.cnn.com/videos/health/2020/11/11/which-masks-work-best-coronavirus-cdc-guidance-todd-tsr-pkg-vpx.cnn
Moving video shows Covid survivor walk for first time in a year,"Apr 5, 2021",https://www.cnn.com/videos/health/2021/04/04/covid-survivor-frontline-worker-peter-woullard-walks-again-nr-sot-vpx.cnn
How long will coronavirus vaccines protect people?,"Apr 4, 2021",https://www.cnn.com/2021/04/04/health/covid-vaccine-protection-lasting-variants-wellness/index.html
"These are the two key things that can help curb another Covid-19 surge, Fauci says","Apr 4, 2021",https://www.cnn.com/2021/04/04/health/us-coronavirus-sunday/index.html
US hits 4 million Covid-19 vaccine doses in a day for a new record,"Apr 3, 2021",https://www.cnn.com/2021/04/03/health/us-coronavirus-saturday/index.html
Dr. Fauci: This is not going to last forever,"Apr 4, 2021",https://www.cnn.com/videos/health/2021/04/03/dr-anthony-fauci-how-we-can-prevent-another-surge-covid-19-cases-nr-vpx.cnn
Traumatizing details of George Floyd's death were shown in court. Experts weigh in on who should -- and shouldn't -- see them,"Apr 3, 2021",https://www.cnn.com/2021/04/03/health/george-floyd-death-details-coping-wellness/index.html
Here's what to know about the risk of blood clots and the AstraZeneca vaccine,"Apr 2, 2021",https://www.cnn.com/2021/04/02/health/astrazeneca-blood-clots-explainer-intl-cmd-gbr/index.html
Medical community reaches out to get the homeless vaccines,"Apr 3, 2021",https://www.cnn.com/videos/health/2021/04/03/vaccinating-the-homeless-dan-simon-ebof-dnt-vpx.cnn
"Fully vaccinated people can gather unmasked and indoors for Easter, CDC says","Apr 2, 2021",https://www.cnn.com/2021/04/02/health/cdc-easter-vaccinated-tweet/index.html
"Americans should continue to follow Covid-19 precautions despite record vaccinations, experts say","Apr 2, 2021",https://www.cnn.com/2021/04/02/health/us-coronavirus-friday/index.html
Psychologist: I expect most young people will bounce back,"Apr 3, 2021",https://www.cnn.com/videos/health/2021/04/01/author-angela-duckworth-emotional-learning-resilience-kids-pandemic-sot-acfc-vpx.cnn
What have scientists learned about kids' well-being from pandemic?,"Apr 3, 2021",https://www.cnn.com/videos/health/2021/04/01/angela-duckworth-grit-help-kids-thrive-pandemic-full-episode-acfc-vpx.cnn
Post-Covid PTSD: the storm after the storm,"Apr 2, 2021",https://www.cnn.com/2021/04/01/health/post-covid-ptsd/index.html
Manufacturing moonshot: How Pfizer makes its millions of Covid-19 vaccine doses,"Apr 1, 2021",https://www.cnn.com/2021/03/31/health/pfizer-vaccine-manufacturing/index.html
"Fully vaccinated people can travel at low risk to themselves, new CDC guidance says","Apr 2, 2021",https://www.cnn.com/2021/04/02/health/cdc-travel-guidance-fully-vaccinated-wellness/index.html
World Autism Awareness Day 2021: What you need to know,"Apr 2, 2021",https://www.cnn.com/2021/04/02/health/autism-awareness-day-wellness/index.html
"More than 11,000 cases of a troubling variant reported in the US. These states have the highest numbers","Apr 1, 2021",https://www.cnn.com/2021/04/01/health/us-coronavirus-thursday/index.html
"Salmonella infections in 8 states could be tied to wild songbirds, CDC says","Apr 2, 2021",https://www.cnn.com/2021/04/01/health/salmonella-outbreak-songbirds/index.html
"Extreme policies, average statistics raise questions around Florida's Covid-19 data","Apr 2, 2021",https://www.cnn.com/2021/04/01/health/florida-covid-data/index.html
J&J says Covid-19 vaccine still on track despite manufacturing snafu,"Apr 2, 2021",https://www.cnn.com/2021/04/01/health/jj-covid-19-vaccine-on-track-despite-snafu/index.html
Pfizer says vaccine protection could last at least 6 months,"Apr 2, 2021",https://www.cnn.com/videos/health/2021/04/01/pfizer-vaccine-protection-length-watt-dnt-tsr-vpx.cnn
Covid-19 variants are putting younger Canadians in ICU,"Apr 2, 2021",https://www.cnn.com/videos/health/2021/04/01/canada-covid-19-variants-younger-cases-newton-dnt.cnn
How the Novavax Covid-19 vaccine works,"Apr 2, 2021",https://www.cnn.com/2021/04/01/health/novavax-covid-19-vaccine-how-it-works-wellness-explainer/index.html
Ongoing trial shows Pfizer Covid-19 vaccine remains highly effective after six months,"Apr 1, 2021",https://www.cnn.com/2021/04/01/health/pfizer-covid-vaccine-efficacy-six-months-bn/index.html
How Major League Baseball is tracking Covid-19 variants,"Apr 1, 2021",https://www.cnn.com/2021/04/01/health/how-major-league-baseball-is-catching-covid-19-variants/index.html
3 behavioral psychology tips for weight loss,"Apr 1, 2021",https://www.cnn.com/2021/04/01/health/weight-loss-behavioral-psychology-wellness-partner/index.html
Win at virtual dating with body language tips from a former FBI agent,"Apr 1, 2021",https://www.cnn.com/2021/04/01/health/virtual-dating-body-language-wellness/index.html
"Stress can be good for you, and here's why","Apr 1, 2021",https://www.cnn.com/2021/04/01/health/stress-good-for-you-wellness/index.html
"CDC director says Americans may soon return to everyday activities, but 'we're not quite there yet'","Mar 31, 2021",https://www.cnn.com/2021/03/31/health/us-coronavirus-wednesday/index.html
She's 14 months old and needs a drug that costs $2.1 million to save her life,"Mar 31, 2021",https://www.cnn.com/2021/03/31/health/toddler-expensive-drug-zolgensma-wellness/index.html
Quality issue at Baltimore vaccine plant delays some of Johnson & Johnson's vaccine,"Apr 1, 2021",https://www.cnn.com/2021/03/31/health/johnson--johnson-vaccine-manufacturing-problem/index.html
"Covid-19 led to a global increase in stillbirths, maternal mortality, and depression, review finds","Apr 1, 2021",https://www.cnn.com/2021/03/31/health/covid-poor-pregnancy-outcomes-study/index.html
Take an exclusive look inside a busy Covid-19 vaccine facility,"Apr 1, 2021",https://www.cnn.com/videos/health/2021/03/31/pfizer-vaccine-manufacturing-exclusive-gupta-vpx.cnn
"Experts predicted the UK variant would become dominant in the US by March. So, is it?","Apr 1, 2021",https://www.cnn.com/2021/03/31/health/uk-variant-dominant-us/index.html
Two US counties to become testing grounds for regular at-home Covid-19 tests,"Mar 31, 2021",https://www.cnn.com/2021/03/31/health/antigen-test-rapid-nih-study-wellness/index.html
"Lab leak Covid-19 theory is like something out of a comic book, virologist says","Mar 31, 2021",https://www.cnn.com/2021/03/31/health/lab-leak-coronavirus-theory-comic-book-scn/index.html
The American Red Cross is in critical need of blood donations right now. Here's how to donate,"Mar 31, 2021",https://www.cnn.com/2021/03/31/health/red-cross-blood-donations-pandemic-wellness/index.html
"Covid-19 was third leading cause of death last year, CDC confirms in early data","Mar 31, 2021",https://www.cnn.com/2021/03/31/health/covid-19-deaths-2020-cdc-report-wellness/index.html
Dr. Leana Wen: Why I'm glad I took part in the Johnson & Johnson vaccine trial,"Mar 31, 2021",https://www.cnn.com/2021/03/31/health/leana-wen-vaccine-trial-wellness/index.html
See what this school is doing to connect with disengaged students,"Mar 31, 2021",https://www.cnn.com/videos/health/2021/03/31/school-absence-coronavirus-challenges-young-dnt-newday-vpx.cnn
Pfizer/BioNTech says its Covid-19 vaccine is 100% effective and well tolerated in adolescents,"Mar 31, 2021",https://www.cnn.com/2021/03/31/health/pfizer-vaccine-adolescent-trial-results/index.html
Parent of child in vaccine trial: We jumped at the opportunity,"Mar 31, 2021",https://www.cnn.com/videos/health/2021/03/31/coronavirus-vaccine-kids-trial-tuchman-pkg-vpx-ac360.cnn
Older adults begin to catch up on all that they missed during the pandemic after Covid-19 vaccinations,"Mar 31, 2021",https://www.cnn.com/2021/03/31/health/older-adults-plans-after-covid-vaccine-khn-partner-wellness/index.html
"As Covid-19 numbers rise, the CDC chief says she's scared about where US is headed. But it's not too late to change country's course","Mar 30, 2021",https://www.cnn.com/2021/03/30/health/us-coronavirus-tuesday/index.html
"Coronavirus likely spread to people from an animal -- but needs more study, new WHO report says","Mar 30, 2021",https://www.cnn.com/2021/03/30/health/who-coronavirus-origin-report/index.html
Covid-19 long hauler says symptoms disappeared after vaccine,"Mar 31, 2021",https://www.cnn.com/videos/health/2021/03/31/covid-19-long-hauler-vaccine-sot-cpt-vpx.cnn
Germany will limit AstraZeneca vaccine to people over 60,"Mar 31, 2021",https://www.cnn.com/2021/03/30/health/astrazeneca-germany-vaccine-intl-grm/index.html
Germany will limit AstraZeneca vaccine to people over 60,"Mar 31, 2021",https://www.cnn.com/2021/03/30/health/astrazeneca-germany-vaccine-intl-grm/index.html
Biden in no rush to pick new FDA chief,"Mar 31, 2021",https://www.cnn.com/2021/03/30/health/fda-commissioner-biden/index.html
CDC director gives emotional warning of 'impending doom',"Mar 29, 2021",https://www.cnn.com/videos/health/2021/03/29/cdc-walensky-warning-30-million-cases-vpx.white-house
Tuskegee isn't the only reason why some Black people are hesitant to get the coronavirus vaccine,"Mar 30, 2021",https://www.cnn.com/2021/03/30/health/tuskegee-syphilis-study-vaccine-distrust-reasons-wellness/index.html
Fill your plate with superfoods,"Mar 30, 2021",https://www.cnn.com/2021/03/30/health/gallery/c2e-superfoods-spc-intl-hnk/index.html
"Coronavirus likely came from animal, not a lab, WHO draft report finds","Mar 30, 2021",https://www.cnn.com/2021/03/29/health/who-coronavirus-origin-draft-report/index.html
