Title,Len,Content
Gurugram: ‘Low infection rate and no deaths among fully vaccinated HCWs’,4003,"GURUGRAM: Four hospitals in the city saw a low infection rate and no deaths among fully vaccinated health care workers in a two-month period from March to May that coincided with the ferocious second wave of Covid that ravaged Delhi-NCR, according to data they have shared with TOI. Collectively, the data covers 9,383 health care workers.
In all four hospitals – Medanta, Park, Narayana and the state-run Civil Hospital – the share of fully vaccinated healthcare workers with ‘breakthrough’ Covid infections despite the immunity shield was in the 6-7% range. Most of them were asymptomatic or had “mild to moderate” symptoms and very few needed ICU care, hospital officials said. The hospitals began looking at infections after 14 days of the second dose. At Medanta, the data is for the period between March 27 and May 21, at Civil from March 23 to May 19, at Park from March 26 to May 23 and at Narayana from March 28 to May 18.

Dr Virender Yadav, chief medical officer (CMO) of Gurugram, said, “No deaths among health care workers were reported after full vaccination. If a person is infected with Covid after 14 days have passed since the second dose of vaccine, it is termed a ‘breakthrough’ infection. In such cases, mortality is negligible. Thus, vaccination is important for all to curb the spread of the infection.”
Medanta’s data shows out of its 4,000 fully vaccinated health care workers, 250 were infected. Of them, eight had moderate symptoms and two had to be admitted in ICU. “Most of our health care workers had mild symptoms and recovered soon. This shows that vaccination provides protection against Covid,” said Dr Sushila Katariya, director and head of internal medicine at Medanta.

Civil Hospital saw ‘breakthrough’ infections in 89 of its healthcare workers, among the 1,425 in inoculated. Three of them got a severe infection and had to be hospitalised. Fifteen had moderate symptoms. “90% were asymptomatic. Symptoms of infected healthcare workers were sore throat, body ache, muscle pain and gastrointestinal pain,” said CMO Yadav.
At the Park group of hospitals, out of the 3,500 health care staff they fully vaccinated, 206 tested positive but none needed to be hospitalised, officials said. Park CEO Dr PN Kakar said, “Vaccines were never labelled as 100% successful. Health care workers went ahead with it as a moral responsibility and duty. End of the day, they all benefited as, though-post vaccination several doctors got infected and some even lost their lives, (those were) not in our hospital but other places.”
At Narayana, 458 healthcare workers had completed both doses and 34 of them got infected. Dr Swadesh Kumar, consultant and head of emergency and medical services at the hospital, told TOI, “Health care workers are committed to their service 24 hours even in these unprecedented times. On our hospital premises, the total number of healthcare workers is 597, of whom 458 are fully vaccinated. Although 34 health care workers got Covid while treating patients, they came back to their jobs after recovery. Around 15-20% got post-vaccination symptoms after the first dose, and only 2-3% got symptoms after the second dose. No deaths were recorded. Vaccination is necessary in the fight against this pandemic.”
Among private hospitals, Max Healthcare had last month released data on infections among its employees after both vaccine doses. The infection rate was similar. Dr Sandeep Budhiraja, group medical director, Max Healthcare, said, “Since the vaccination drive commenced on January 16 for healthcare workers, close to 14,000 employees across our network hospitals received both doses. Of this set, 6% got the Covid infection and 90% of those infected were mild cases. Only 10% required hospitalisation. All of them recovered well except one elderly clinician who was admitted in ICU but unfortunately succumbed to the disease. This proves that the vaccine is effective and significantly reduces infection rates as well as severity of the disease.”
"
"West Bengal sets up panel, gets ready to upgrade paediatric Covid infrastructure",3143,"KOLKATA: The Bengal government on Wednesday set up an experts’ committee with the aim of preparing itself for the eventuality that kids may be the most affected during the third wave of the pandemic, even as the health department started the process of revamping the state’s paediatric Covid infrastructure.
The department is very likely to set up a paediatric Covid-care unit with around 1,000 beds, 20% of it devoted to a paediatric intensive care unit (PICU) at Medical College and Hospital (MCH). The decision came after a high-level meeting at Swasthya Bhavan on Wednesday, during which senior officials took feedback from the committee on what kind of preparedness should be taken up.

“Since MCH has the experience of treating paediatric Covid patients right from the first wave, we are planning to have a big unit for treating children there in case a third wave hits,” said a source. “We need to be fully prepared so that we can counter the wave better.”
Augmenting paediatric Covid infrastructure includes being prepared on several fronts: keeping beds ready, procuring ventilators and other medical equipment, training human resources like doctors and nurses on the different needs of infected children. All these aspects were discussed during the meeting, the source said. The exert committee also pointed out deficiencies and shortages we might face in case more children are affected in the third wave. “Their inputs will be seriously considered so that we are not caught offguard,” he added.

MCH now has 25 paediatric Covid beds. Some other hospitals, like ICH (Institute of Child Health) has also started their Covid units, as have private hospitals like Apollo Gleneagles and Fortis Hospital.
“Though there is no robust scientific data on the third wave, the hypothesis of its possibility is based on what several Western countries are experiencing,” said paediatric intensivist Prabhas Prasun Giri, who’s an associate professor at ICH. “That we saw a larger number of unvaccinated younger population getting infected in the second wave leads us to expect that the paediatric population could be the target in the next wave. That is why we need to revamp paediatric facilities.”
Noticing the rise in the number of symptomatic patients during the second wave last month, an experts’ committee (not the one set up on Wednesday) had prepared a Covid treatment protocol for children.
Healthcare experts apprehend the third wave, if it happens, during the months of winter festivity. Paediatrician Pallab Chatterjee of Apollo Gleneagles Hospital said PICU beds for patients of other ailments, too, were scarce in peripheral hospitals; even in the city, there are not enough. He said preparedness was key in handling the third wave.
“One silver lining is that most children don’t get severe infection. In kids, the ACE2 receptor, through which the spike protein of the virus goes into the body, is not well developed in the respiratory tract. Hence, the virus attacks children mostly in the gastrointestinal tract, causing issues like diarrhoea and dehydration. It might be a lot easier to treat them than adults,” said Chattejee.
"
Exhaustion and fear for India's frontline doctors in Covid battle,3564,"NEW DELHI: Low pay, 24-hour shifts and severe shortages of staff and protective gear have left many doctors on the frontlines of India's brutal pandemic surge near breaking point and fearful for their lives.
Coronavirus infections have killed at least 165,000 people in the vast South Asian nation -- home to some of the world's most densely populated cities -- since the start of April.

Although India's latest Covid-19 surge has eased recently, around 3,000 people are still dying every day and the chronically underfunded health care system remains under severe pressure.
""We are overworked, stressed and very frightened,"" Radha Jain, a doctor in the capital New Delhi, told AFP.

The Indian Medical Association said more than 1,200 doctors have died of Covid since the start of the pandemic -- including over 500 in the last two months.
Deependra Garg, a doctor working in Delhi's outskirts, knows first-hand how dire the situation has become.
His wife Anubha, 48, a physician herself, fell ill with Covid in April.
They started treatment at home but as her condition worsened, he -- like so many other families -- struggled to get a hospital bed.
He eventually found one almost 200 kilometres (120 miles) from their home. But Anubha -- who was fully vaccinated -- died within two weeks, leaving behind their 12-year-old daughter.
""We are on the frontlines 24/7. We are exposed to a high virus load but we have to continue working against all odds as we have chosen this profession,"" Garg said.
""We do not have a choice.""
The pandemic has exposed structural weaknesses in India's healthcare system, particularly in the ill-equipped state-run hospitals.
As the latest outbreak spread, reports emerged from short-staffed hospitals of patients lying on floors and sharing beds in packed wards, as family members protected with only cotton masks took care of their stricken loved ones.
The government spends less than two percent of GDP on healthcare, one of the lowest rates in the world.
India had just 0.8 doctors per 1,000 people in 2017 -- around the same level as Iraq, according to the World Bank. The two other countries worst-hit by the coronavirus, Brazil and the US, had 2.2 and 2.6 respectively.
A report from before the pandemic by the US-based Center for Disease Dynamics, Economics and Policy estimated that India needed 600,000 more doctors and two million extra nurses to meet its healthcare needs.
Doctor Shekhar Kumar, working with a private hospital in the northern state of Uttar Pradesh, said junior staff and final-year medical students sometimes had to work 24-hour shifts.
""Compared to last year, this time patients are needing longer hospital stays which is increasing the burden on the staff,"" Kumar said.
He added that they were further stretched when their colleagues fell ill with the virus.
Doctors said they had been traumatised by being forced to choose which patients to save first as they grappled with insufficient supplies of medicine and oxygen.
Ravikant Singh, the founder of a charity group helping to set up Covid field hospitals, said he struggled to sleep some nights.
""It's been a life-changing situation for doctors,"" Singh told AFP.
""The worst part was... we could not save many lives because of the lack of oxygen.""
Even after completing their punishing shifts, doctors said they worried about infecting their families at home.
Kumar said he would constantly think about how the virus was ""lurking anywhere and everywhere"".
""If doctors can't save their (own) lives, how will they save the lives of others?"" he said.
"
RJD chief Lalu Prasad slams Nitish Kumar over ‘poor’ health facilities in Bihar,1831,"PATNA: RJD chief Lalu Prasad is using social media platforms as a tool to attack chief minister (CM) Nitish Kumar.
On Tuesday he shared a photo of a referral hospital at Chandrayan in Saharsa, which was built at a cost of Rs 14 crore and inaugurated by him on November 18, 1995, on his Twitter handle. The name plaque installed on the occasion is, however, missing.



Taking cognisance of the matter, Lalu tweeted, “The hospital was set up to provide medical facilities to the people living on both the eastern and the western flanks of the embankment. But it met the same fate as thousands of other such hospitals in the state.”

The photo was initially uploaded by the Saharsa district unit of the RJD, which was later shared by Lalu. The party alleged that the referral hospital at Chandrayan had virtually turned into a “bhoot bungalow”.
The development comes a day after a similar photo related to a hospital at Chakbajitpur under Hilsa assembly segment in Nalanda district was shared by the former CM on his Twitter handle. Lalu blamed Nitish for the closure of the health facility in his native district.


Reacting to Lalu’s tweet, JD (U) spokesperson Neeraj Kumar said, “He (Lalu) has become more active on social media ever since the Jharkhand high court granted him bail on health grounds. Had he improved the health facilities in the state during his tenure, the situation would have been quite different.”
The JD (U) MLC added, “The people are aware of the situation that prevailed in government hospitals during the RJD regime. A rise in the number of footfalls during the NDA rule is a proof of the kind of work that has been done in the field of healthcare in the state.”
Meanwhile, sources close to the first RJD family denied the report of Lalu’s visit to Patna in the near future due to “his health condition”.
"
Healthcare should be made accessible in villages: Docs,3135,"PATNA: With the state witnessing the worst of human sufferings during the second wave of Covid and black fungus that followed it, the medical fraternity has now called for reshaping of the healthcare facilities from district headquarters to blocks for facing any such challenges in future.
National president-elect of the Indian Medical Association, Dr Sahajanand Prasad Singh, said panchayat representatives and mukhiyas, who are familiar with most villagers, would have to play an important role in screening diarrhoea, flu and fungal diseases and report the same to the nearest healthcare facility.

“The government must provide at least two oximeters in every village to be regularly used by trained heath staff under the supervision of panchayat people. It will help monitor oxygen saturation level, the sudden decline of which led to happy hypoxia condition,” he said.
Dr Singh added the second wave of Covid pandemic reminded lawmakers and authorities concerned not to keep the healthcare facilities confined to big urban hospitals, but to extend it down to villages.

“Though there is no evidence of any new disease, there are strong chances of new strains to appear in the days to come,” said Dr B P Singh, head of cardiology at the Indira Gandhi Institute of Medical Sciences (IGIMS), Patna.
He said viruses tend to get stronger for their survival by undergoing mutations and becoming more fatal. “Taking a lesson from Covid which demanded reinforcement of medicines and equipment, there is now an urgent need of a micro-level preparation to strengthen the health facilities down to villages. Environmental changes, lifestyle and injudicious use of drugs too could lead to many severe conditions,” he said.
Former superintendent of Patna Medical College and Hospital Dr Rajiv Ranjan Prasad said lack of selective or specific anti-viral drugs was the main reason for the rise in complications due to viral infections, including Covid. “Most pathogenic microbes are identified and their drugs developed. Their mutation, transmission ability and effect on human organs remain uncertain till leading to diseases,” he said.
Dr Prasad said the Covid spread rejuvenated the health system with rush of oxygen and other medicines and underlined the need for enhancing the strength of medical workers and doctors. “Basic healthcare facilities, trained persons and simple diagnostic appliances to test blood pressure, blood sugar and oxygen saturation should be provided to every village,” he added.
Dr Satyajeet Singh, managing director of Ruban Memorial Hospital, said the preventive and social medicine branch of medical science could play a vital role in creating a healthy environment by making people aware on personal hygiene, proper lifestyle and immunity boosting food habits which could help lower the incidents of dozens of diseases which, if neglected, could prove fatal.
“There always stands possibility of new biological agents like bacteria and virus, sometimes adapted forms of insects, causing disease of intense effects. We have faced cholera, plague and tuberculosis and are now exposed to Covid,” Dr Satyajeet said.
"
"Need uniform, effective law against healthcare violence: Top medical body to Amit Shah",1280,"NEW DELHI: The Indian Medical Association on Tuesday wrote a letter to Union home minister Amit Shah and urged him to ensure strong and effective action against healthcare violence.
In the letter signed by IMA chief Dr J A Jayalal, the doctors' body said that incidents of healthcare violence have increased over the years and have become widespread.

""While the entire medical fraternity stands with you and is working tirelessly during the pandemic, it is also facing a serious threat from healthcare violence,"" it said.



The IMA mentioned the recent incident in Assam where a doctor was assaulted by the relatives of a Covid patient.
It said that doctors and healthcare staff are finding it difficult to work under the stress of violence.
""The real size of the problem is largely unknown and recent information shows that the current knowledge is only the tip of the iceberg,"" it said.
The IMA pitched for a comprehensive, uniform, and effective law against the healthcare violence.
""We request you to kindly approve an effective and strong act against the healthcare violence. Medical profession being different from the rest of the professions, it becomes necessary to have a strong act against violence specifically for the healthcare professionals and workers,"" it said.
"
Plan now for your healthcare in old age,0,
Easing restrictions for Sundargarh with high active caseload raises eyebrows,2435,"BHUBANESWAR: The state government's special relaxation for Sundargarh in the extended lockdown has surprised health experts.
While extending the ongoing lockdown from June 1 until June 17, the state government on Sunday made some exceptions for three districts, the other two being Nuapada and Gajapati. Most of the shops in the three districts can remain open from 7am to 1pm from Mondays to Fridays. In the rest of the state, only shops dealing in essential items, food, vegetables, fish, meat, eggs and milk can open during the lockdown. Their timings have been restricted to four hours from 7am to 11am.

This is a modal window.

No compatible source was found for this media.

Healthcare experts said it was justifiable to ease the curbs for Nuapada and Gajapati, which have a low active caseload of around 500 each, a weekly average test positivity rate (TPR) of below 10% and both the districts have been consistently reporting very few new infections. However, the relaxations given to Sundargarh have baffled many because this western Odisha district has 4,917 active cases, which is the fourth highest after Khurda (11,470), Cuttack (7,764) and Angul (4,964). Sundargarh's TPR for the past one week from May 23 to May 30 has been above 11%. The number of new infections in the district per day is around 500 or more. Sundargarh has reported 267 Covid deaths, the third highest after Khurda (468) and Ganjam (283).
Defending the government's decision, health minister Naba Kishore Das said, ""It has a decentralised approach. The decision has been taken on the basis of the feedback from the district administrations.""

However, health experts were not convinced with the government's logic. ""I don't understand the rationale behind giving relaxations to Sundargarh. The reasons for Nuapada and Gajapati can be understood, but not Sundargarh,"" Ashok Mahapatra, former director of AIIMS Bhubaneswar, who is currently the vice-chancellor of SOA University, said.
R K Purohit, a doctor based in Bargarh, too, said, ""The government move defies logic. I don't see any scientific reason behind giving Sundargarh such a lot of leeway when the situation is still unwarranted.""
Assuaging their apprehensions, director (public health) Niranjan Mishra said, ""High positivity rate is not the only consideration behind giving relaxation to any district. The government considers the situation in totality, taking all factors into account.""
"
Uttar Pradesh: Health workers pay homage to dead peers,950,"LUCKNOW: Healthcare workers across the state observed two-minute silence on Monday afternoon and offered tributes to their colleagues who have lost their lives to Covid-19 since 2020.
They lighted candles in front of banners bearing photographs of all those who died of Covid.

“People in hospitals or offices stood in silence as a tribute to our colleagues. Those at home lit a candle there. We have requested the government again that compensation as promised to these families be paid and all their other dues such as pension also facilitated at the earliest,” said vice-president of State Employees’ Joint Council Suneel Yadav.
The tribute was held in coordination with Indian Public Service Employees’ Federation, State Employees’ Joint Council, Pharmacists’ Federation, State Nurses’ Association and others. NHM Employees’ Association will hold a similar memorial service for over 30 colleagues who died of Covid-19 since March 2020 on June 2.
"
"Uttar Pradesh: Health staff dead, kin await Rs 50 lakh grant",3302,"LUCKNOW: Government school teacher Preeti lost her husband Sri Saran Srivastava (52), chief pharmacist at the Chinhat community health centre, to Covid-19 on January 4 this year. The tragedy was not only devastating but led to the family income dropping by 60%. Their son could not take admission to the US-based university he got selected for.
Now, the single mother also has a mounting home loan, but her applications for compensation have not received any concrete answers so far.

Many healthcare worker families like Preeti’s, which have lost their bread winners to Covid-19, complain that they are struggling to get the promised Rs 50 lakh insurance under Pradhan Mantri Garib Kalyan Package for corona warriors. Preeti claimed that their own house is still under construction and authorities have asked them to vacate the accommodation allotted to her husband.
“Forget about compensation, even pension has not started despite several reminders. Besides loan EMIs, paying children’s education fees has become difficult. We have shelved the plan to send our son for medical education to the US,” she added.

According to healthcare workers’ associations, Covid-19 has snuffed out lives of 149 healthcare workers so far: these are 75 doctors, 40 NHM-outsourced employees, 20 permanent staff including nurses, and 14 pharmacists. Among these, eight doctors, six NHM workers and six nurses are from Lucknow.
Director general medical health Dr DS Negi said, “The names of 48 healthcare workers who died of Covid-19 have been sent to the central government for Rs 50 lakh compensation. Of these, nine have got it, five applications were rejected and others are pending.
UP Employees’ Joint Council vice-president Suneel Yadav claimed that some applications were rejected because the healthcare worker was not deployed in a Covid hospital.
“The infection risk is equal in all hospitals because Covid cases came for treatment everywhere, hence all victims who got infected at workplaces must be compensated,” he said.
President of National Child Health Programme Employee Union Dr Anand Singh, said Dr Mahendra Pal, posted at a Covid hospital in Moradabad, died on September 2, 2020. The Moradabad CMO had forwarded the compensation application, but the insurance company rejected it saying he had turned Covid negative by the time of death.”
KGMU staff nurse Asha Dhusia died of Covid-19 on September 21.
Her son Shubham said, “My mother got infected during duty in the triage area. Since then, we have been making rounds of offices for compensation and pension with no conclusive answer.”
Lab technician at Balu Adda CHC Ritesh Raj Mishra (28), collected samples for tests without taking any leave from March 2020 to April 2021, till he got infected and died on April 18.
“He was felicitated by the mayor and police for devotion, but we are in the dark about compensation,” said Ritesh’s father Jitendra Mishra.
A paediatrician at a government hospital died last June. Hospital chief Dr Sudha Verma said, “All documents were submitted last year itself, but we don’t know why approval is still pending.”
UP Provincial Medical Services Association general secretary Dr Amit Singh said that authorities should ensure that the victim’s family doesn’t have to run around for compensation or other benefits.
"
