Title,Len,Content
Covid-19: High daily cases worry Bhubaneswar despite 72% population vaccinated,1224,"BHUBANESWAR: The capital city has been grappling with a high daily rise in infections, but its vaccination pace has been exceedingly good with 72% of its target population having taken both the jabs.
Healthcare experts feel that containing the breakthrough (infection of vaccinated people) infection, strengthening of enforcement activities, checking cluster spread through micro containment and protecting the 0-18 age group of people are ways forward to reduce the impact of the second wave and rule out the possibility of a third one.

Throughout July, the city has been adding more than 300 cases daily. On Wednesday, however, it reported 182 new infections against 175 recoveries. This took the active cases to 2,062. The city accounts for close to half of Khurda’s 4500 active cases.
“We need to ensure that the floating population of the city doesn’t spread the infection. Most importantly, the fully vaccinated people should not lower their guard,” Ajay Parida, director, Institute of Life Sciences (ILS), said.

On Wednesday, the state added 1703 new Covid cases registering a test positivity rate of 2.16, down from 2.59% a day earlier.
The government also confirmed 69 more Covid deaths taking the toll to 5,703.
"
Covid-19: High daily cases worry Bhubaneswar despite 72% population vaccinated,1224,"BHUBANESWAR: The capital city has been grappling with a high daily rise in infections, but its vaccination pace has been exceedingly good with 72% of its target population having taken both the jabs.
Healthcare experts feel that containing the breakthrough (infection of vaccinated people) infection, strengthening of enforcement activities, checking cluster spread through micro containment and protecting the 0-18 age group of people are ways forward to reduce the impact of the second wave and rule out the possibility of a third one.

Throughout July, the city has been adding more than 300 cases daily. On Wednesday, however, it reported 182 new infections against 175 recoveries. This took the active cases to 2,062. The city accounts for close to half of Khurda’s 4500 active cases.
“We need to ensure that the floating population of the city doesn’t spread the infection. Most importantly, the fully vaccinated people should not lower their guard,” Ajay Parida, director, Institute of Life Sciences (ILS), said.

On Wednesday, the state added 1703 new Covid cases registering a test positivity rate of 2.16, down from 2.59% a day earlier.
The government also confirmed 69 more Covid deaths taking the toll to 5,703.
"
Cognizant posts record-high attrition in April-June quarter even as revenue growth picks up,3531,"CHENNAI: IT major Cognizant on Thursday posted 12% revenue growth year-on-year in constant currency terms and around 4.5% in sequential terms for the April-June quarter.
Even as the company beat street estimates in terms of revenue growth and increased its outlook for the year, a hot tech job market is impacting the IT bellwether adversely as it reported life-time high attrition levels in the quarter.

This is a modal window.

No compatible source was found for this media.

Quarterly annualised attrition stood at 31% compared to 21% in the previous quarter and 24% in the same quarter last year. Further, voluntary attrition (annualised) stood at 29% compared to 18% in March and 11% in the same period last year.
At a revenue of $4.6 billion and growth of 12% in the quarter, the company's performance lags rivals such as TCS and Infosys for the comparable period. TCS posted almost 19% YoY revenue growth (CC terms) and Infosys revenues grew around 16% in the quarter.

Cognizant's net income was at $512 million up only marginally from $505 million in the last quarter but a jump from $361 million it made in the same period last year.
""We delivered a strong second quarter,"" Cognizant CEO Brian Humphries said. ""Through targeted investments, we've been shifting our portfolio to faster-growing market segments while extending our capabilities and partnerships to help clients build modern businesses. I see a stronger, more competitive Cognizant emerging, with growing commercial momentum. We are bullish on the industry and our prospects within it.""
Commenting on the attrition in the conference call with analysts, Humphries said: ""We've seen primarily the attrition in the more junior levels of the organization or mid-levels in India, but it's also a global phenomenon. It's really one of the hottest markets we've seen or our team has seen over the last 10-plus years.""
Cognizant's revenue from financial services increased approximately by 5%. Healthcare revenue increased 13%, and products and resources revenue grew 18%. Digital revenue grew approximately 20% year-over-year.
Buoyed by improved performance, Cognizant increased its revenue guidance for the full year 2021. The company expects 2021 revenue at $18.4-$18.5 billion; i.e., 9-10% growth in CC terms, compared to 5.5%-7.5% growth it guided to in the last quarter. However, this outlook factors in favourable impact from currency movements of 120 basis points (100 basis points = 1%) and approximately 320 basis points contribution from inorganic revenue.
""Second quarter top-line results exceeded our guidance, driven by improved demand for our services and momentum in our digital revenue, and we increased our full-year 2021 revenue growth to 10.2-11.2%,"" Cognizant CFO Jan Siegmund said. ""To meet the strong client demand for our services, we have continued to scale our recruiting capabilities and invest in our people.
Despite record attrition, in the April-June quarter, Cognizant crossed the 300,000 employees mark for the first time in its history with the majority of the employees in India.
""We now expect to hire approximately 100,000 laterals in 2021 and to train close to 100,000 associates. In addition, we expect to onboard approximately 30,000 new graduates in 2021 and make 45,000 offers to new graduates in India for 2022 onboarding,"" Humphries said on the earnings call.
The company also said it has currently vaccinated 160,000 of its associates and families and set up nearly 1,000 Covid-19 hospital beds for communities in India.
"
Kerala government tells private hospitals to fast-track vaccinations,3135,"KOCHI: On one hand, the state government’s vaccination drive has come to a standstill due to unavailability of Covid vaccines, while on the other, over 6 lakh vaccines are still available with private hospitals in the state. The state government has now written to private hospitals to use up their vaccine stocks to ensure that the state gets its vaccine quota.
The Kerala government is planning to administer at least the first dose to maximum beneficia- ries before Onam on August 21, Dr Rathan Kelkar, executive director of state health agency (SHA) has stated in a letter to the private hospitals.

This is a modal window.

No compatible source was found for this media.

“In order to demand more vaccine from GoI (Government of India), the state has to utilize the maximum of received vaccines. In this scenario, it is requested that all hospitals have to schedule more number of sessions and administrate maximum number of doses per day,” he said in the letter. There are around 29,040 doses of Covaxin and 6,66,345 doses of Covishield unused in 106 private hospitals. The letter, sent on July 26 — when vaccine stock in government hospitals here exhausted — further added that the Centre is monitoring vaccination details like daily vaccination count, balance stock etc., of hospitals and has requested the state government to “administrate the maximum of private hospitals stock as soon as possible”.
A private hospital, on average, vaccinates around 300-500 persons, with large hospitals vaccinating 700 plus persons by organizing special camps. After implementation of GoI’s new vaccination policy in May 2021, so far, private hospitals have administered 12,24,599 doses.

Sources said that despite vaccine shortage in government hospitals, there is a reluctance among people to get vaccinated at a private hospital. “This is due to the cost factor involved. Many are willing to wait for free vaccine provided by the government,” said Dr M I Sahadulla, chairman and MD, KIMS Healthcare Group and president of Association of Healthcare Providers India (Kerala chapter). While Covaxin is priced at Rs1,410 in a private hospital, it is Rs 780 for Covishield.
However, private hospital managements are unable to understand the connection between vaccine availability in private hospitals and the state demanding more vaccines. With the new vaccination policy, private hospitals have to directly procure 25% vaccine quota from manufacturers on advance payment. Vaccines for small private hospitals, procuring less than 6,000 doses, will be distributed by the state.
“Private hospitals get their 25% vaccine quota once a month, while the state gets its vaccine stock from the Centre every week depending on their 75% vaccine usage the previous week. There is no connection between vaccines received for the government and private hospitals,” said Dr Jayakrishnan AV, chairman, Indian Medical Association’s (IMA) committee for vaccination promotion and coordination.
“Some small and medium private hospitals received their vaccine stock only two days back,” said Dr Joseph Benaven, secretary, Kerala Private Hospitals Association.
"
Chinchinim health centre completes home jab drive,1161,"Colva: Chinchinim primary health centre vaccinated 46 bedridden and octogenarians in the past three days within its jurisdiction.
The centre inoculated 11 on Monday, 18 on Tuesday and 17 on Wednesday, concluding its three-day drive.

Senior health staff members said that they sent letters to panchayats in its area to alert bedridden persons or those who cannot make it to the centre for vaccination. The centre also provided a ‘Whatsapp’ number for registration of names.
Accordingly, after receiving the registrations, they chalked out the route to inoculate the persons within four hours of opening a vial. Villages of Sarzora, Ambelim, Chinchinim, Varca, Orlim, Carmona and Cavelossim come under the jurisdiction of Chinchinim health centre.

Eleven individuals can be administered a jab with one vial within the stipulated time beyond which it becomes ineffective.
The persons who had registered for the drive were told that the visiting staff would not be able to stay back to monitor the beneficiary for 30 minutes after the vaccine was administered so as to curtail wastage of vaccines.
The staff said that they received a good response for the drive.
"
New collector takes charge in Visakhapatnam,971,"VISAKHAPATNAM: The Visakhapatnam new collector A Mallikharjuna said that he would give equal priority to the urban, rural and tribal areas development. He said it would be possible with the cooperation and coordination with the officials of the district.
The 2012 batch IAS officer Dr. Annam Mallikharjuna assumed office on Wednesday. Speaking to media persons, the collector and district magistrate said that he would be available for the public and would focus very much on the implementation of government welfare schemes.
Mallikharjuna hails from the Chintakommadinne mandal of Cuddapah district. He did his graduation in MBBS from Kurnool Medical College and has had the experience of working as a doctor at a PHC, before joining the Indian Administrative Service (IAS). He was previously posted as the Additional Commissioner, CRDA before moving to the East Godavari district. He was transferred to Vizag from the post of CEO of Dr. YSR AarogyaSri Healthcare Trust
"
Blood clots in people with severe Covid-19 linked to abnormal antibody response: Study,2705,"LONDON: Inflammation and blood clotting seen in very severe cases of Covid-19 may be caused by the antibodies sent to fight the disease triggering unnecessary platelet activity in the lungs, according to a study published on Wednesday.
The researchers, including those from Imperial College London in the UK, also found that it was possible to reduce or stop platelets from responding in this way by treating blood with active ingredients from different drugs known to either inhibit platelet function or immune responses.

This is a modal window.

No compatible source was found for this media.

The study, published in the journal Blood, shows how antibodies produced by our bodies to protect against Covid-19 are activating increased function of platelets, which may be causing fatal blood clots in patients with severe disease.
Platelets are small cells found in the blood which form clots to stop or prevent bleeding, but abnormal platelet function can lead to serious health concerns such as strokes and heart attacks.

""Until now, we have only had assumptions about why platelets involved in clotting were being activated during Covid-19 infection,"" said Professor Jon Gibbins, from the University of Reading in the UK.
""The antibodies that are produced to stop Covid-19 from spreading trigger infected cells to induce platelet activity which causes clotting even though there is no wound that needs healing,"" Gibbins said.
In the latest study, the researchers took antibodies produced to fight the coronavirus's spike protein, from people with severe Covid-19 infections, and cloned them in a laboratory.
The spike protein helps the SARS-COV-2 virus to infect and enter the human cells.
The researchers found that the small sugars found on the surface of these antibodies were different from antibodies from healthy individuals.
When they introduced those cloned antibodies in a lab to blood cells taken from healthy donors, there was an observed increase in platelet activity.
The study suggests that it may be possible for drugs that are currently used to treat immune system problems to reduce or stop the cells from developing an exaggerated platelet response.
A trial led by Imperial College London and Imperial College Healthcare NHS Trust is already testing these drugs in clinical trials with patients at hospital sites across the UK to see whether they will reduce serious clotting for hospitalised Covid-19 patients, the researchers said.
The study of platelets in the laboratory establishes important mechanisms that explain how and why dangerous blood clots may occur in severely ill Covid-19 patients, and importantly, also provides clues as to how this may be prevented, they added.
"
Delhi CM Arvind Kejriwal asks Delhiites to suggest names for Padma awards,2372,"NEW DELHI: Delhi government will only recommend the names of doctors and healthcare personnel for Padma awards this year “as a mark of gratitude to honour their service and sacrifice” during the pandemic.
This was announced by chief minister Arvind Kejriwal on Tuesday, while asking Delhiites to suggest names for the awards.

This is a modal window.

No compatible source was found for this media.

The government has released an email address — padmaawards.delhi@gmail.com — for submitting the suggestions.
People can send in their recommendations by August 15 with a description of why they think the person named deserves the honour. The names would be checked by a “Search and Screening Committee” headed by deputy CM Manish Sisodia to decide the final list of nominations. Recently, Kejriwal had written to PM Narendra Modi seeking Bharat Ratna for doctors and healthcare workers.

“This decision has been taken to honour the service and sacrifice of the medical community during the Covid-19 crisis. We have asked the people of Delhi for the nominations as they are the ones who actually know the most about the dedication and hard work of our doctors,” the CM said, while thanking doctors and healthcare workers for relentlessly giving everything they could to save lives during one of the biggest crises seen by humanity.
Every year, the country honours a select few with Bharat Ratna and Padma awards. The central government gives these awards to people who have showcased excellent work in their field. For all three Padma awards, the Centre asks people to nominate figures who they think deserve the honour. State governments are also asked to nominate such personalities.
Expressing his heartfelt gratitude, Kejriwal said, “During the pandemic, doctors, healthcare workers and paramedical staff helped save a lot of lives. They served humanity with impeccable commitment. I know many doctors and healthcare workers who did not go home for days. I also know many doctors and healthcare workers who got infected while tending to patients and were, unfortunately, martyred on duty.”
“The entire humanity is indebted to such doctors. No matter how much we thank them, it won’t suffice for their sacrifice. Delhi government is the only government in the country that gave a Samman Rashi of Rs 1 crore to frontline workers who were martyred on duty,” added the CM.
"
World Hepatitis Day: 'Vaccination against hepatitis as important as against Covid',0,
PIL: Fix minimum healthcare standard and rates for hospitals,2217,"NEW DELHI: At a time when 70% of patient care is provided by private sector healthcare institutions, the Supreme Court on Tuesday sought responses from the Centre, states and Union Territories on a PIL seeking implementation of minimum standards of healthcare and display of rate chart for treatments by all hospitals as per Clinical Establishments Act, 2010.
A bench of Chief Justice N V Ramana and Justice Surya Kant issued notices to all states, UTs and National Human Rights Commission and said, ""Let's hope the governments will respond positively.""

This is a modal window.

No compatible source was found for this media.

Appearing for NGO 'Jan Swasthya Abhiyan', senior advocate Sanjay Parikh said with the focus shifting from strengthening the public sector healthcare system to private sector, only 30% of patients get treatment from government owned hospitals and healthcare centres. With privatisation of the healthcare system, the patients are getting fleeced by the private hospitals and clinics as there is no enforcement of the Clinical Establishment Act of 2010 and the relevant Rules framed in 2012.

TIMES VIEW

Displaying rate charts is the law which many private hospitals flout. We need strict monitoring to ensure that the law is duly followed. Violators should be punished.



Parikh said the Union government, in consultation with states, is yet to frame and notify ""conditions for registrations: minimum standards of facilities and services; minimum requirement of personnel; provisions of maintenance of records and reporting; fixation of rates for each type of procedure and services within the range of rates determined by the central government issued from time to time.""
He said in the absence of framing and notifying the minimum standards, the clinical establishments in 17 states and UTs are operating on the basis of provisional registration.
The PIL, filed through advocate Srishti Agnihotri, sought a direction to the Centre to ""operationalise all the provisions of the 2010 Act and 2012 Rules, and among others, direct that the conditions for registration which include the observance of minimum standards, display and observance of determined rates for procedures and services.”
"
"Hong Kong, China shares battered by regulation fears; yuan drops",4522,"SHANGHAI: Hong Kong's benchmark index and Chinese A-shares extended sharp losses to end at multi-month closing lows on Tuesday, as investors worried over the impact of tighter government regulations.
What started off as a sell-off in shares bled into fixed income and foreign exchange markets by Tuesday afternoon, sending the yuan falling through psychologically significant levels and pushing Chinese 10-year government bond futures down 0.35%, as traders scrambled to come to terms with the rout.

This is a modal window.

No compatible source was found for this media.

""I can only understand that domestic speculative longs have surrendered and stampeded in the face of uncertainty,"" said a Shanghai-based brokerage manager.
The onshore and offshore yuan turned around sharply from small gains against the dollar to weaken past 6.5 per dollar to more than three-month lows.

A trader at a foreign bank said the breach of the 6.5 level could lead to further weakness for the yuan.
""Banks are busy asking their clients to execute dollar conversions into yuan to take advantage of current prices,"" she said.
In equity markets, Hong Kong's benchmark Hang Seng Index fell 4.22% to its lowest close since November, bringing its losses since Thursday to more than 9.5%. The Hang Seng China Enterprises Index closed 5.08% lower.
The Hang Seng Tech index slumped through its previous record low to end down 7.97% on the day. It has lost more than 16% since Thursday's close.
The Hang Seng's losses accelerated in late afternoon trade after index heavyweight Tencent announced that its WeChat app has temporarily suspended registration of new users in mainland China as it undergoes a technical upgrade ""to align with relevant laws and regulations"".
Tencent ended the day 8.98% lower, its steepest daily drop since October 2011.
Food delivery platform Meituan fell 17.66%, its biggest-ever daily drop, after China's market regulator announced a set of reforms to strengthen protections for food delivery workers.
The Hang Seng Healthcare Index also recorded a record drop, falling 9.25% as investors feared the sector could be the next target of stricter government oversight.
In mainland markets, China's blue-chip CSI300 index ended down 3.53% at its lowest close since November, extending Monday's 3.2% sell-off. The Shanghai Composite index gave up early gains to end 2.49% lower at 3,381.18, its lowest close since March 25.
Falls were wide-ranging, with the CSI financial sector sub-index down 3.17%, the consumer staples sector off 4.75% and the healthcare sub-index down 3.9%.
The rout came after a shakeout on Monday spurred by new rules reining in China's $120 billion private tutoring sector, sending some shares plunging more than 45%, and new regulatory moves targeting technology and property.
""Beijing's severe crackdown on the tech and education sectors had ignited the re-pricing of significant regulation risks on investment for Chinese private companies,"" Ken Cheung, chief Asian FX strategist at Mizuhuo Bank, said in a note.
""As such, foreign investors will request a deeper discount on such Chinese investment or even cut the exposure on Chinese companies,"" Cheung added.
Education shares continued to slide on Tuesday, with New Oriental Education & Technology Group Co falling 8.63%, taking its drop over the last three sessions to more than 70%, while the CSI education index tumbled 4.97%.
Worst-case scenario
Anita Chu, an analyst at CCB International, said in a research report that the unfavourable regulatory environment could force firms to spin off after-school tutoring operations or even delist, and issued a downgrade and reduced the target price for New Oriental.
""According to our estimates, the potential spinoff of (after-school tutoring) operations would take 60-70% off the earnings of New Oriental and 80-90% off (New York-listed) TAL Education.""
In Hong Kong, heavily indebted developer China Evergrande Group extended its losses, spiralling 13.41% lower to end at 4-1/2 year lows, after the company said it would cancel a special dividend proposal.
The broader property sector in Hong Kong dropped 2.55% and real estate A-shares ended 4.51% lower.
Adding to broader concerns about the economic outlook, profit growth at China's industrial firms slowed for a fourth straight month in June, as high raw material prices weighed on factories' margins.
A surge in highly contagious Delta variant Covid-19 cases centred on the eastern city of Nanjing also spurred fresh worries on Tuesday.
"
