Title,Len,Content,Publishing Date
Health care industry spends $30 billion a year on marketing,5890,"Spending on health care marketing nearly doubled from 1997 to 2016, soaring to at least $30 billion a year, according to a study published Tuesday in JAMA. “Marketing drives more testing. It drives more treatments,"" said Steven Woloshin, the study co-author and co-director of the Center for Medicine and Media at the Dartmouth Institute for Health Policy and Clinical Practice. ""It’s a big part of why health care is so expensive, because it’s the fancy, high-tech stuff things that get marketed."" His study captured only a portion of the many ways that drug companies, hospitals and labs promote themselves. Advertising doesn’t just persuade people to pick one brand over another, said Woloshin. Sophisticated campaigns make people worry about diseases they don’t have and ask for drugs or exams they don’t need. Consumer advocates say taxpayers pay the real price, as seductive ads persuade doctors and patients alike to order pricey tests and brand-name pills. “Whenever pharma or a hospital spends money on advertising, we the patients pay for it — through higher prices for drugs and hospital services,” said Shannon Brownlee, senior vice president of the Lown Institute, a Brookline, Massachusetts, nonprofit that advocates for affordable care. “Marketing is built into the cost of care.” High costs ultimately affect everyone, because they prompt insurance plans to raise premiums, said Diana Zuckerman, president of the National Center for Health Research, a nonprofit that provides medical information to consumers. And taxpayers foot the bill for publicly funded insurance programs, such as Medicare. “These ads can be amazingly persuasive, and they can exploit desperate patients and family members,” said Zuckerman, who was not involved in the new study. Drug companies spend the bulk of their money trying to influence doctors, showering them with free food, drinks and speaking fees, as well as paying for them to travel to conferences, according to the study. Yet marketers also increasingly target consumers, said Woloshin, who wrote the study with his wife and longtime research partner, Dartmouth’s Dr. Lisa Schwartz, who died of cancer in November. The biggest increase in medical marketing over the past 20 years was in “direct to consumer” advertising, including the TV commercials that exhort viewers to “ask your doctor” about a particular drug. Spending on such ads jumped from $2.1 billion in 1997 to nearly $10 billion in 2016, according to the study. Holly Campbell, a spokeswoman for the Pharmaceutical Research and Manufacturers of America, said its ads provide “scientifically accurate information to patients.” These ads “increase awareness of the benefits and risks of new medicines and encourage appropriate use of medicines,” she said. The makers of genetic tests — including those that allow people to learn their ancestry or disease risk —also bombard the public with advertising. The number of ads for genetic testing grew from 14,100 in 1997 to 255,300 in 2016, at a cost that year of $82.6 million, according to the study. AncestryDNA spends more than any other company of its kind, devoting $38 million to marketing in 2016 alone. Some companies are touting stem cell treatments that haven’t been approved by federal regulators. The Food and Drug Administration has approved stem cell therapy for only a few specific uses — such as bone marrow transplants for people with leukemia. But hundreds of clinics claim to use these cells taken from umbilical cord blood to treat disease. Many patients have no idea that these stem cell therapies are unapproved, said Angie Botto-van Bemden, director of osteoarthritis programs at the Arthritis Foundation. Stem cell clinics have boosted their marketing from $900,000 in 2012 to $11.3 million in 2016, according to the study. In recent months, the Food and Drug Administration has issued warnings to clinics marketing unapproved stem cell therapies. Twelve patients have been hospitalized for serious infections after receiving stem cell injections, according to the Centers for Disease Control and Prevention. Medical advertising today goes beyond TV and radio commercials. Some online campaigns encourage patients to diagnose themselves, Woloshin said. The website for Restasis, which treats dry eyes, prompts patients to take a quiz to learn if they need the prescription eye drops, said Woloshin, who wrote a February study with Schwartz on the drug’s marketing strategy. The Restasis website also allows patients to “find an eye doctor near you.” Many of the doctors included in the Restasis directory have taken gifts from its manufacturer, Allergan, Woloshin said. The doctor directory includes seven of the top 10 physicians paid by the company, his study says. In a statement, Allergan spokeswoman Amy Rose said the company uses direct-to-consumer advertising “to support responsible disease awareness efforts.” The ads “do not displace the patient/physician relationship, but enhance them, helping to create a well-informed and empowered consumer and patient communities.” But drug sites don’t just lead patients to doctors, Woloshin said. They also provide scripts for suggested conversations. For example, the website for Viagra, which treats erectile dysfunction, provides specific questions for patients to ask. The website for Addyi, often called the “female Viagra,” goes even further. Patients who answer a number of medical questions online are offered a 10- to 15-minute phone consultation about the drug for $49. Patients who don’t immediately book an appointment receive an email reminder a few minutes later. “This is more evidence,” Brownlee said, “that drug companies are not run by dummies.” Kaiser Health News is a nonprofit news service covering health issues. It is an editorially independent program of the Kaiser Family Foundation that is not affiliated with Kaiser Permanente.","Jan. 9, 2019"
White House used Mitt Romney health-care law as blueprint for federal law,8811,"Newly obtained White House records provide fresh details on how senior Obama administration officials used Mitt Romney’s landmark health-care law in Massachusetts as a model for the new federal law, including recruiting some of Romney’s own health care advisers and experts to help craft the act now derided by Republicans as “Obamacare.”  The records, gleaned from White House visitor logs reviewed by NBC News, show that senior White House officials had a dozen meetings in 2009 with three health-care advisers and experts who helped shape the health care reform law signed by Romney in 2006, when the Republican presidential candidate was governor of Massachusetts. One of those meetings, on July 20, 2009, was in the Oval Office and presided over by President Barack Obama, the records show.  “The White House wanted to lean a lot on what we’d done in Massachusetts,” said Jon Gruber, an MIT economist who advised the Romney administration on health care and who attended five meetings at the Obama White House in 2009, including the meeting with the president. “They really wanted to know how we can take that same approach we used in Massachusetts and turn that into a national model.” Romney has forcefully defended the Massachusetts law he signed, but says he is adamantly against a “one-size-fits-all national health-care system” imposed on all 50 states. “I will repeal Obamacare,” he has said. “And on day one of my administration, I will grant a waiver from Obamacare to all 50 states.” Asked about about the White House records Tuesday at a press conference announcing New Jersey Gov. Chris Christie's endorsement, Romney said the people involved in the White House meetings were ""consultants,"" not ""aides."" He added that ""one person (Obama) should have talked to was me."" The response echoed comments that Romney made last April after Obama suggested the White House had borrowed from his law in Massachusetts. “He does me the great favor of saying that I was the inspiration of his plan,” Romney said of Obama. “If that’s the case, why didn’t you call me? …Why didn’t you ask what was wrong? Why didn’t you ask if this was an experiment, what worked and what didn’t. … I would have told him, ‘What you’re doing, Mr. President, is going to bankrupt us.’” The White House visitor logs suggest that, if Obama officials didn’t talk directly with Romney, senior presidential aides did consult with others — like Gruber — who played important roles in helping to craft and implement the Massachusetts law. In addition to Obama himself, the meetings attended by Gruber were presided over by the president’s chief economic adviser, Lawrence Summers, then budget director Peter Orzag and Nancy-Ann DeParle, the president’s chief adviser on health care, the records show. Gruber was also given a $380,000 contract by the Obama administration in 2009 to work with Congress on drafting a new federal law based on the Massachusetts law, records show. Another Romney administration adviser consulted by the White House was Jon Kingsdale, a health-care expert who was appointed in 2006 by one of Romney’s Cabinet secretaries, Thomas Trimarco, to serve as executive director of the Commonwealth Health Insurance Connector Authority — the state agency charged with implementing the new Massachusetts health-care law. Who met with whom
The White House records show Kingsdale attended three White House meetings on health care in 2009. Another expert who attended four White House meetings on health care was John McDonough, who also had played a leading role in shaping the law signed by Romney. As the head of a health-care advocacy group in Massachusetts, McDonough was named by Romney aides as a “stakeholder” to represent consumer interests on the health-care law. McDonough later shared an “innovator in health award” with Romney and 11 others — including several top lawmakers and business leaders — given by NEHI, a leading New England health-care research group, “for their collaborative efforts in achieving Massachusetts health reform.” The health-care reform law in Massachusetts was seen as a national breakthrough when Romney signed it an elaborate ceremony — complete with a fife and drum band — at Boston’s historic Faneuil Hall on April 12, 2006. It was attended by an array of prominent political figures in the state, including the late Sen. Ted Kennedy, a longtime champion of health-care reform. Kennedy warmly praised Romney at the event, saying, “You’ve led the way over the long and winding path to this moment.” Romney himself touted the historic significance of the act. “Massachusetts once again is taking a giant leap forward,” he said at the signing ceremony.  The key features of the new law were an individual mandate, which required state residents to purchase health insurance or face a tax penalty — and the creation of a state agency to help the uninsured to purchase private health insurance plans at reasonable costs. It was touted by Romney at the event as a way of “expanding coverage to all our citizens.” Romney has since emphasized differences between his law in Massachusetts and ""Obamacare,"" saying the state law didn’t require any increase in taxes. But the extent to which Romney’s 2006 health-care law served as a blueprint for Obama’s health care plan has been a recurring issue in the GOP presidential contest. Obama aides have fueled the controversy. Romney “did some interesting things there on health care,” David Axelrod, the president’s political adviser, said in an interview earlier this year. “We got some good ideas from him.” On Monday, Texas Gov. Rick Perry’s campaign unleashed a blistering attack ad — called “Romney’s Remedy” — that accused the former Massachusetts governor of running away from his record on health care. “Even the richest man can’t buy back his past,” reads a tag line on the ad. It cited a line that Romney had deleted this year from the paperback edition of his book, “No Apology: The CASE for American Greatness,” discussing the Massachusetts law which read: “We can accomplish the same thing for everyone in the country.” “When it comes to government-mandated health care, there is no difference between Mitt Romney and President Obama,” Perry spokesman, Mark Miner, said in a press release accompanying the ad. Romney’s aides shot back, accusing Perry of distorting his record on health care and taking quotes out of context. “Rick Perry is a desperate candidate who will say and do anything to prop up his sinking campaign,” said Gail Gitcho, Romney’s communications director. The role of Gruber could complicate the Romney campaign’s efforts to address the issue. An economist who specializes in health-care issues, he was hired by the Romney’s administration as a consultant and asked to run computer models on the costs of various approaches to extending health-care coverage. He told NBC News he attended one meeting with Romney in which the then governor forcefully insisted on including a controversial provision that some of his political advisers were wary about: the “individual mandate” that would require everybody in the state to purchase health insurance or face a tax penalty. The same provision has since become the most contentious feature of Obama’s Affordable Care Act. “This was a big decision to be made and Governor Romney clearly stated that he believed without an individual mandate healthy people could just free ride on the system,” Gruber said of Romney’s decision. Connection played down
Romney aides have recently tried to suggest that Gruber was not a true adviser to Romney and did not play a big role in shaping the law. But Gruber was personally recognized by Romney for his role when he signed the health-care bill into law and was later appointed by Romney as a board member to the Connector Authority. (He also was given a photograph of the signing ceremony personally signed by Romney that read: “Jonathan, with deep appreciation and congratulations. A Triumph! Mitt Romney."")     Gruber now says he is “proud” of Romney for “sticking up for what he did in Massachusetts” but is “disappointed” about his current efforts to make distinctions between the state law and the Affordable Care Act. (He also noted that the Massachusetts law didn’t require any increase in taxes only because it received federal health-care funds that defrayed the costs of the new law.)   Romney is “the father of health-care reform,” said Gruber. “I think he is the single person most responsible for health care reform in the United States. … I’m not trying to make a political position or a political statement, I honestly feel that way. If Mitt Romney had not stood up for this reform in Massachusetts … I don’t think it would have happened nationally. So I think he really is the guy with whom it all starts.” ","Oct. 11, 2011"
Amy Coney Barrett’s past critiques on Obamacare face scrutiny,6329,"WASHINGTON — Judge Amy Coney Barrett, President Donald Trump’s newly announced Supreme Court nominee, whose appointment could cement a conservative court majority for a generation, is on record criticizing past judicial decisions upholding the Affordable Care Act. In a 2017 Notre Dame Law School article, Barrett quoted from Justice Antonin Scalia, who protested 2012 and 2015 rulings upholding core provisions of the law and lamented that Obamacare should be renamed “SCOTUScare.” Barrett’s scholarly writings are giving fuel to Democratic arguments that her appointment could upend health coverage for 20 million Americans. They provide her opponents with a paper trail of comments on the politically salient health care law that they lacked with Trump's prior court nominees Brett Kavanaugh and Neil Gorsuch. “For Justice Scalia and those who share his commitment to uphold text, the measure of a court is its fair-minded application of the rule of law, which means going where the law leads. By this measure, it is illegitimate for the Court to distort either the Constitution or a statute to achieve what it deems a preferable result,” Barrett wrote in the January 2017 article. Regarding a 2012 ruling upholding the law’s individual mandate by a 5-to-4 margin, National Federation of Independent Business v. Sebelius, Barrett also criticized Chief Justice John Roberts, saying he had “pushed the Affordable Care Act beyond its plausible meaning to save the statute.” Barrett would be Trump’s third appointment to the nation’s highest court, and with Republicans in control of the Senate, Democrats say they are clear-eyed about their limited procedural options for halting the appointment. If confirmed, Barrett could take her seat just before an election Trump is already saying he expects to be decided by the Supreme Court. With the nation experiencing a pandemic that’s already claimed 200,000 lives and left at least 6 million with potential Covid-19-related “pre-existing” conditions, Democrats are focusing on health care to persuade voters that Barrett’s appointment will have a direct impact on their lives. A new lawsuit led by Texas and supported by the Trump administration is coming before the Supreme Court on Nov. 10. ""The American people should make no mistake — a vote by any Senator for Judge Amy Coney Barrett is a vote to strike down the Affordable Care Act and eliminate protections for millions of Americans with pre-existing conditions,"" Senate Minority Leader Chuck Schumer, D-N.Y., said, describing her as the potential ""deciding vote"" to invalidate the law. A Senate Republican aide familiar with the nomination process said it was a ""fool's errand to predict how judges will rule"" on particular cases, such as the ACA lawsuit, after they're confirmed. The aide, who spoke on condition of anonymity, indicated that Barrett is likely to address the issue during the process. Some legal scholars say Barrett’s past writings indicate sympathy for prior challenges to Obamacare but don’t reveal how she'd rule in the upcoming case, which hinges on a different legal question. Jonathan Adler, a professor at Case Western Reserve University School of Law and an architect of the 2015 legal challenge to ACA subsidies, said Barrett’s passage evoking “SCOTUScare” was “a fairly straightforward description of the Scalia dissent.” “Given her embrace of textualism, it might be fair to suggest she found his opinion more convincing than the majority,” he said. “The second indicates some disapproval for the Chief Justice's NFIB opinion and its stretching of the text.” But Adler said that wouldn’t be inconsistent with believing the pending Texas case should fail. “Neither tells us much of anything about her views of the current ACA suit, however, as many of us who thought Roberts was wrong in NFIB, and that Scalia was correct in King, believe that Texas should lose the current case,"" he said in an email, referencing the 2015 case King v. Burwell. Nicholas Bagley, a professor at the University of Michigan Law School and a critic of recent ACA litigation, said Barrett’s article suggests she would've sided with Scalia in the 2012 case, but said it “doesn't tell us anything about how she'd rule in a case that's significantly weaker.” Still, Bagley warned not to discount the legal danger Obamacare faces after the death of Justice Ruth Bader Ginsburg, who voted in the majority in both cases involving the law. “I think ACA supporters should be concerned,” he said in an email. “Not panicked: The lawsuit is weak and the Supreme Court is unlikely to endorse it. But a small risk of a bad thing is worth worrying about.” Republicans have failed to undo the ACA legislatively, despite controlling Congress and White House for two years of Trump’s administration, and haven’t offered a replacement if the lawsuit succeeds. “Where is that Republican substitute bill?” Sen. Dick Durbin, D-Ill., asked in a Judiciary Committee hearing this week. Demand Justice, a progressive group that plans to spend as much as $10 million to build opposition to Barrett's nomination, released an ad Friday warning that if Barrett ""were on the Supreme Court, millions of Americans could lose their health insurance."" As a candidate, Trump criticized Roberts for voting to uphold the ACA, tweeting: “My judicial appointments will do the right thing unlike Bush’s appointee John Roberts on ObamaCare.” “We should be rightly concerned that he’s going to keep his word,” Sen. Dianne Feinstein, the top Democrat on the Judiciary Committee, said during a Thursday hearing. On Saturday, after Trump officially announced Barrett as his pick, Democrats said her confirmation to the high court would cost millions of people their health care. ""Today, President Trump nominated Judge Amy Coney Barrett to the Supreme Court — a jurist with a written track record of disagreeing with the Court’s decision to uphold the Affordable Care Act,"" Joe Biden, the 2020 Democratic presidential nominee, tweeted. ""Vote like your health care is on the ballot — because it is."" House Speaker Nancy Pelosi, D-Calif., said in a statement that should Barrett be confirmed, ""millions of families’ health care will be ripped away in the middle of a pandemic that has infected seven million Americans and killed over 200,000 people in our country.""","Sept. 27, 2020"
"Top Democrats jump-start push to offer a health care 'public option,' a Biden promise",2658,"WASHINGTON — Two Democratic committee chairs overseeing health care policy are seeking to jump-start a legislative push to craft a ""public option"" to compete with private insurers. House Energy and Commerce Chair Frank Pallone, D-N.J., and Senate Health, Education, Labor and Pensions Chair Patty Murray, D-Wash., wrote a letter to interested parties Wednesday seeking their input by July 31 on how to structure a government-provided plan. ""We believe bold steps are necessary in order to achieve universal coverage and lower health care costs,"" they wrote. ""Health care affordability remains a challenge for many American families despite the fact that the United States spends more on health care than any other country."" Pallone and Murray touted the Affordable Care Act's successes at extending coverage but noted that ""tens of millions of Americans still remain uninsured or underinsured."" A ""public option"" was one of President Joe Biden's campaign promises, billed as a moderate alternative to rival Bernie Sanders' plan to scrap private coverage and put all Americans in Medicare. But Biden has not included the policy in his economic rescue and stimulus proposals so far, instead seeking to infuse cash in the ACA exchanges and invest in Covid-19 vaccines. But the Democrats are signaling it is still a priority, and aim to introduce a bill by the end of this year, a Murray aide said. It will be a daunting task for Democrats, who have paper-thin margins in Congress and not much hope of winning Republican support. They are likely to face an assault from health industry groups, including insurers who won't want to compete with the government, as well as doctors and hospitals who would complain about likely reductions in reimbursement rates. In their letter, Murray and Pallone requested information that would help them on the design and scope of the legislation, including whether the federal public option should be made available to all individuals or more targeted. And in a statement, they cited a recent Morning Consult/Politico poll that shows 68 percent of Americans favor a public option, ""where people can choose from a government-run health program or private insurance."" Recently, Democrats have offered competing bills for a public option, which was considered in the 2010 Affordable Care Act legislation and dropped after some party defections. Sens. Michael Bennet, D-Colo., and Tim Kaine, D-Va., introduced the Medicare-X Choice Act, which would set up a Medicare-style public option. And Sens. Sheldon Whitehouse, D-R.I., and Sherrod Brown, D-Ohio., introduced the CHOICE Act to add a public option to the Affordable Care Act.","May 26, 2021"
