Title,Len,Content
"Vaccination of 60-plus population sluggish after initial high, experts raise concerns",5556,"NEW DELHI: The pace of vaccination of the 60-plus population has become sluggish in the past few weeks after an initial high, with healthcare experts attributing it to mobility issues and misinformation and unsubstantiated apprehensions about the jabs.
According to Union health ministry data, 2.29 crore elderly people have been fully vaccinated so far while 6.71 crore have received just one dose of Covid-19 vaccine till now.

This is a modal window.

No compatible source was found for this media.

The 60-plus population in India was projected to be at 14.3 crore in 2021, so that would imply that just 16 per cent of them have been fully vaccinated till now.
Vaccination for those over 60 years of age and those of 45-plus with co-morbidities started from March 1 at both government and private centres.

Coronavirus: Live updates
On an average about 80.77 lakh vaccine doses were given to the 60-plus population per week between March 13 and April 2, but the weekly figure dropped to about 32 lakh between June 5 to 25, according to the data.
Healthcare experts expressed concern over the slow place of vaccination of the 60-plus people who are more prone to have co-morbidities and remain more susceptible to severe disease.
Dr Sujeet Ranjan, Executive Director of The Coalition for Food and Nutrition Security (CFNS), said myths, misconceptions and rumours about Covid-19 vaccines are the biggest hurdle to vaccination coverage.

READ ALSO
Centre to provide over 19 lakh Covid-19 vaccine doses to states, Union territories in next 3 days

NEW DELHI: The Central government will provide more than 19,10,650 Covid-19 vaccine doses to states and Union territories in the next three days, the health ministry said on Saturday. According to the ministry of health and family welfare (MoHFW), as many as 1,45,21,067 balance and unutilised Covid


""Some people think they will never contract Covid-19, others believe that the virus itself is on the way out. Irrational mistrust of scientifically approved vaccines is also a factor. While vaccine hesitancy has always been a phenomenon in our country, today it tends to accentuated by opinions on social media, where even people with no subject expertise but having wide following can influence people,"" he said.
""Some people in rural areas believe that Covid-19 is mostly for urban people. Also, many people have heard on the social media that the vaccine and its side-effects will show up two to three years from now. These rumours, suspicion and fear are making it harder to remove vaccine hesitancy,"" he added.
He said it has also been observed that most public places in rural areas lack senior citizen-friendly infrastructure.
Hospitals have expressed concern over the slow pace of vaccination of 60-plus people who also suffer from the maximum number of comorbidities.
Dr Shuchin Bajaj, Founder Director, Ujala Cygnus Group of Hospitals, said vaccine hesitancy in the elderly population is a very real issue.
""Among many factors, one is a fear that people with previous heart disease will have some issue because of some unfortunate videos that were circulating around. Some people have done their CRP (c-reactive protein) tests also to see if that was raised and then they feel that they should not take the vaccine,"" Bajaj said.
Bajaj said mobility is also a very big issue for the 60-plus age group.
""The most important problem is mobility because they are not really able to visit the vaccination centres themselves and also they have a fear that if they go into a crowded place, they will catch Covid. We need to ensure that we educate them about the various risk factors and try to provide vaccination to them at their doorstep,"" he said.
Dr. Piyush Goel, Senior Consultant- Pulmonary and Critical Care, Columbia Asia Hospital, Palam Vihar, Gurugram, said for mass-scale vaccine coverage, vaccine hesitancy is one of the biggest hurdles.
""As there has been a recent drop in the pace of vaccination among people above the age of 60, there are fears that this vaccine hesitancy can hamper the coverage of this population group most vulnerable to Covid-19,"" he said.
Dr. Roshan Palresha, Consultant - Emergency Medicine, Columbia Asia Hospital, Pune, said the recent drop in Covid vaccine coverage among the 60-plus group of people is a cause of concern as they are more prone to have comorbidities, and remain more susceptible to severe disease.
“People aged 60 and more must understand that while the number of infected people may go up or down, their vulnerability to the disease and chances of mortality remain the same, and can be reduced only with vaccines,"" he said.
""In the past we have successfully reduced cases of HIV/AIDS and polio through sustained and focussed media campaigns, and it should help this time too. Government representatives must engage in dialogue with these people and may also come up with non-financial incentives to encourage people,"" he suggested.
Dr. HK Mahajan, Anesthesiologist, Indian Spinal Injuries Centre, Vasant Kunj, said focus should be on getting across two key vaccine messages — vaccines provide protection against Covid-19 and vaccines are safe.
Mahajan said vaccine hesitancy in people over the age of 60 years in India could also be because of misinformation, myth and skepticism.
To counter this, Mahajan suggested that front-line health workers and hospitals should issue statements in favour of vaccination.
""Influential people like film actors, famous personalities should also be tapped to appeal to the public to get vaccinated,"" he said.
"
Vaccination of 60-plus population sluggish after initial high; experts raise concerns,5114,"NEW DELHI: The pace of vaccination of the 60-plus population has become sluggish in the past few weeks after an initial high, with healthcare experts attributing it to mobility issues and misinformation and unsubstantiated apprehensions about the jabs.
According to Health Ministry data, 2.29 crore elderly people have been fully vaccinated so far while 6.71 crore have received just one dose of Covid-19 vaccine till now.

This is a modal window.

No compatible source was found for this media.

The 60-plus population in India was projected to be at 14.3 crore in 2021, so that would imply that just 16 per cent of them have been fully vaccinated till now.
Vaccination for those over 60 years of age and those of 45-plus with co-morbidities started from March 1 at both government and private centres.

On an average about 80.77 lakh vaccine doses were given to the 60-plus population per week between March 13 and April 2, but the weekly figure dropped to about 32 lakh between June 5 to 25, according to the data.
Healthcare experts expressed concern over the slow place of vaccination of the 60-plus people who are more prone to have co-morbidities and remain more susceptible to severe disease.
Dr Sujeet Ranjan, Executive Director of The Coalition for Food and Nutrition Security (CFNS), said myths, misconceptions and rumours about Covid-19 vaccines are the biggest hurdle to vaccination coverage.
""Some people think they will never contract Covid-19, others believe that the virus itself is on the way out. Irrational mistrust of scientifically approved vaccines is also a factor. While vaccine hesitancy has always been a phenomenon in our country, today it tends to accentuated by opinions on social media, where even people with no subject expertise but having wide following can influence people,"" he said.
""Some people in rural areas believe that Covid-19 is mostly for urban people. Also, many people have heard on the social media that the vaccine and its side-effects will show up two to three years from now. These rumours, suspicion and fear are making it harder to remove vaccine hesitancy,"" he added.
He said it has also been observed that most public places in rural areas lack senior citizen-friendly infrastructure.
Hospitals have expressed concern over the slow pace of vaccination of 60-plus people who also suffer from the maximum number of comorbidities.
Dr. Shuchin Bajaj, Founder Director, Ujala Cygnus Group of Hospitals, said vaccine hesitancy in the elderly population is a very real issue.
""Among many factors, one is a fear that people with previous heart disease will have some issue because of some unfortunate videos that were circulating around. Some people have done their CRP (c-reactive protein) tests also to see if that was raised and then they feel that they should not take the vaccine,"" Bajaj said.
Bajaj said mobility is also a very big issue for the 60-plus age group.
""The most important problem is mobility because they are not really able to visit the vaccination centres themselves and also they have a fear that if they go into a crowded place, they will catch Covid. We need to ensure that we educate them about the various risk factors and try to provide vaccination to them at their doorstep,"" he said.
Dr. Piyush Goel, Senior Consultant- Pulmonary and Critical Care, Columbia Asia Hospital, Palam Vihar, Gurugram, said for mass-scale vaccine coverage, vaccine hesitancy is one of the biggest hurdles.
""As there has been a recent drop in the pace of vaccination among people above the age of 60, there are fears that this vaccine hesitancy can hamper the coverage of this population group most vulnerable to Covid-19,"" he said.
Dr. Roshan Palresha, Consultant - Emergency Medicine, Columbia Asia Hospital, Pune, said the recent drop in Covid vaccine coverage among the 60-plus group of people is a cause of concern as they are more prone to have comorbidities, and remain more susceptible to severe disease.
“People aged 60 and more must understand that while the number of infected people may go up or down, their vulnerability to the disease and chances of mortality remain the same, and can be reduced only with vaccines,"" he said.
""In the past we have successfully reduced cases of HIV/AIDS and polio through sustained and focussed media campaigns, and it should help this time too. Government representatives must engage in dialogue with these people and may also come up with non-financial incentives to encourage people,"" he suggested.
Dr. HK Mahajan, Anesthesiologist, Indian Spinal Injuries Centre, Vasant Kunj, said focus should be on getting across two key vaccine messages -- vaccines provide protection against Covid-19 and vaccines are safe.
Mahajan said vaccine hesitancy in people over the age of 60 years in India could also be because of misinformation, myth and skepticism.
To counter this, Mahajan suggested that front-line health workers and hospitals should issue statements in favour of vaccination.
""Influential people like film actors, famous personalities should also be tapped to appeal to the public to get vaccinated,"" he said.
"
"On visit to Novavax facility, Indian ambassador lauds 'robust' Indo-US healthcare cooperation",2245,"WASHINGTON: India's Ambassador to the United States Taranjit Singh Sandhu on Friday visited the facilities of pharma major Novavax saying its partnership with Serum Institute of India (SII) is an example of the “robust” India-US healthcare cooperation.
Headquartered in Gaithersburg, Maryland, Novavax is a biotechnology company that focuses on the discovery, development and commercialisation of vaccines to prevent infectious diseases.

This is a modal window.

No compatible source was found for this media.

During his discussions with Stanley C Erck, President, Chief Executive Officer & Director at Novavax, Sandhu said the partnership between Novavax and SII is another example of the “robust India-US healthcare cooperation”, especially in the manufacturing of affordable and accessible vaccines and medicines.
Erck briefed the ambassador on the high efficacy of the COVID-19 vaccine as per trials held so far. In January 2020, Novavax announced development of a coronavirus vaccine candidate. Subsequently Novavax and India's SII had entered into a vaccine manufacture agreement with the Novovax vaccine expected to be distributed as 'Covavax' in India.

On June 14, Novavax had announced overall 90.4 per cent efficacy in Phase-3 trials in US and Mexico.
Sandhu noted that healthcare sectors in both countries have been collaborating through joint research, sharing of technical expertise and knowledge exchange.
The Indian envoy has reached out to a large number of pharma companies in the US. His outreach to vaccine manufacturers/firms in the vaccine supply chain include Pfizer, Moderna, Johnson & Johnson, Air Products, AdvaMed, Thermo Fisher, Eli Lilly, Pall Corporation, Antylia, Cytiva, Genentech, Ligand, etc.
Earlier this month, he had also visited Ocugen and Jubilant Pharma facilities.
Founded in 1987, Novavax operates through developing recombinant vaccines. The company, through its recombinant nanoparticle vaccine technology, produces vaccine candidates to respond to both known and newly emerging diseases.
Its product pipeline focuses on a range of infectious diseases with vaccine candidates in clinical development for respiratory syncytial virus (RSV), seasonal influenza, pandemic influenza and the Ebola virus.
"
"Puducherry: Active Covid cases below 3,000 after 70 days",917,"PUDUCHERRY: The number of active Covid-19 cases dropped below 3,000 on Friday for the first time since April 13 in the Union territory of Puducherry. After adding 261 cases and 363 recoveries on Friday, the UT had 2,970 under treatment for the viral infection.
The territory continued to report less than 300 fresh cases for the seventh consecutive day on Friday. Puducherry headquarters reported the maximum fresh cases with 225 followed by Karaikal (20) and Yanam and Mahe with eight each.

This is a modal window.

No compatible source was found for this media.

Five patients an died of the infection taking the death toll to 1,739. The infection’s fatality rate remained 1.5%.
The territory has so far reported 1.16 lakh cases of which 1.11 lakh patients recovered registering a recovery rate of 96%. Healthcare authorities have so far administered 4.56 lakh doses of anti-Covid vaccine (including second dose.)
"
Cops draw up list of 14 aides,1557,"Kolkata: The day police commissioner Soumen Mitra said they would probe the role of all the accomplices of fake vaccine camp accused Debanjan Deb to solve the “inhuman and perverted” crime, detective department said it had finalized a list of 14 people who helped Deb hold the fake camps. All of them were hired by Deb and paid well.
Police said they questioned four persons on Friday and brought all of them face-to-face with Deb. “If required, we might arrest some,” said joint CP (crime) Murlidhar Sharma. Sources said they would see if any of the aides was a trained healthcare worker. Several of them claimed they had accompanied Deb to KMC headquarters and to missionaries to distribute PPE and sanitizers. Some reportedly paid Deb Rs 1.5 lakh-Rs 2 lakh to land jobs at KMC, said cops.

This is a modal window.

No compatible source was found for this media.

Police said Amikacin vials, bought in the name of KMC, were taken to Deb’s Kasba office, where the staff replaced the labels with fake Covishield ones. “Deb designed the fake Covishield labels on his computer but someone else provided him with the sample and the labels were printed at a Sealdah unit. We are questioning both,” said an officer.
Lalbazar hinted they might write to KMC. “Deb had written on fake letterhead and holograms of KMC. A few had fake state government letterheads. But they were never posted to Nabanna or KMC. Deb claimed they were used to impress guests,” the But he was close to a number of KMC sub-contractors and lower-level officers of KMC,” the officer added.
"
Thyrocare deal completes our diagnostics play: PharmEasy’s parent co,1542,"After closing the deal in Navi Mumbai on Friday evening, API Holdings CEO Siddharth Shah told TOI, “With Thyrocare, we will offer a holistic platform to the consumer for the entire outpatient healthcare — including consultations, diagnostic tests and treatment. In PharmEasy, we have about 80,000 pharmacies and 6,000 doctors, and only the diagnostics play was missing, which has now been completed with this deal.” API is the parent company of digital healthcare firm PharmEasy, founded by Dharmil Sheth, Dhaval Shah, Harsh Parekh, Hardik Dedhia and Siddharth Shah.
The latest deal, in the making for over a month, was struck at 30x ebitda. “Over the last year, we have created our diagnostics business worth Rs 75 crore, and wanted to build on it. Over the next 18 months, we plan to add growth to the diagnostics business, and reach our unified services to each pincode in the country,” he said, adding Thyrocare — with its 4,000 lab partners and a pan-India network — was the best fit. PharmEasy, with a gross merchandise value (GMV) of Rs 7,500 crore, claims to be the largest online pharmacy and diagnostics brand, RetailIO, and DocOn – a leading consultation and EMR platform.
The company has a base of 12 million-plus consumers, a network of over 6,000 digital consultation clinics and around 90,000 pharmacies (retailers) across the country. It currently serves over 1 million patients for their pharmacy and diagnostics needs, conducts over 300,000 consultations, and issues over 1 million digital prescriptions on a monthly basis.
"
Covid-19: ICMR study has good news for fully jabbed,2629,"NEW DELHI: A preliminary report on breakthrough infections based on a small sample size of 361, collected by ""passive and voluntary"" reporting from healthcare centres in Odisha, found 274 were Covid positive after being fully vaccinated.
These 274 individuals had also completed the 14-day window post full vaccination by which time antibodies are expected to develop.

Read our coronavirus live blog for all the latest news and updates

READ ALSO
Covishield comprises over 90% of 12.76 crore Covid vaccines administered so far

Of the 127,605,870 Covid-19 vaccination jabs administered till now, 11,60,65,107 are of Covishield while 1,15,40,763 are of Covaxin, according to the government's CO-WIN portal.



The samples were collected from healthcare centres in Odisha between March 1 to 10 June. Those who were not fully vaccinated had recieved one dose. While the samples were then sent for laboratory confirmation, there was a likelihood of these individuals being Covid positive given the prevalence of the second wave at the point in time. Given the concerns over infections, it can be assumed that people visited healthcare facilities only if they felt the need to do so.

TIMES VIEW

Delta Plus is a variant of concern. But, on current evidence, as noted virologists point out, an alarmist approach helps none. Let us not forget that many are already grappling with Covid-related mental and physical problems. Nevertheless, it needs to be reasserted that Covid-appropriate behaviour must continue and the vaccination drive further speeded up.


While a significant proportion of laboratory-confirmed Covid-19 cases were fully vaccinated, over 83% of them showed symptoms and only 9.9% of the symptomatic breakthrough infections required hospitalisation, the study conducted by the Indian Council of Medical Research shows, offering evidence that vaccines protect against severe illness.

READ ALSO
Home-based Covid-19 testing kit CoviSelf: All you need to know

NEW DELHI: The Indian Council of Medical Research on Wednesday cleared one home testing kit for detecting Covid-19 infections and also issued an advisory for its use. ICMR chief Dr Balram Bhargava had recently said the government is exploring home testing solutions to increase the testing capacity


Out of 361 samples, 76% were found to be positive after 14 days of receiving complete doses of the vaccines. The study is yet to be peer-reviewed. The number of hospitalisations was low and only one death was reported out of the 27 hospitalised individuals. The seropositivity in individuals receiving Covishield (96.7%) was higher than in Covaxin (77.1%).
"
"‘Vaccine effective, kept 97% Goa Medical College staff safe from Covid’",2922,"PANAJI: Even as the vaccination drive has gained momentum, some people are sceptical and question the efficacy of the jab. Doctors in the state continue to debunk myths and point to statistics that show the number of people who got Covid-19 after either taking the first or both doses is negligible.
Experts said that some ask what is the point of taking the shot if one can get infected even after that, but for instance, out of the 4,500 healthcare workers at Goa Medical College (GMC), less than 150 — either fully or partially vaccinated — got infected, which is about 3%.

This is a modal window.

No compatible source was found for this media.



“More than 90% of doctors and other healthcare workers in GMC have been vaccinated and, despite working in the Covid hospital, fewer than 150 of them contracted the virus. None of them were hospitalised and fatalities were nil,” head of the department of preventive and social medicine at GMC, Dr Jagadish Kakodkar, told TOI.

Kakodkar said that it must be borne in mind by those who are doubtful about the vaccine that the majority of GMC’s doctors and other staff, despite working throughout the second wave when infectivity was high, did not get the infection.
Covid-related fatalities among healthcare workers across the country, he said, was less as compared to the first wave. It was because they were vaccinated when the second wave hit, Kakodkar said.
“Despite the Delta strain being more severe and infectious fewer healthcare workers contracted the virus, also mortalities were less. This proves that the majority will not get the infection if vaccinated. The disease will be mild among those few who may get it,” he said.
It is certain that people who are vaccinated fully with a gap of 84 days between the two doses, receive almost 92% to 94% protection, Kakodkar said. The protective efficacy of the Covishield vaccine when two doses given 84 days apart, is maximum.
“Unvaccinated people are not only vulnerable to infection but 10% to 15% of them will develop moderate disease and 1% to 3 % will die due to the severity of the infection. Severe to moderate infection is definitely prevented by the vaccine,” he said.
Out of the 3,000 Covid deaths reported in the state, the majority were not inoculated. While few died after the first dose and six died despite two doses, all of them had severe co-morbidities, like advanced cancer, kidney disease, heart failure and uncontrolled diabetes, he said.
“We can’t say people have died despite taking the vaccine. They may have died due to their comorbidities. The vaccine has been proven safe and most feared complications at the beginning of the drive, like deaths and anaphylaxis reaction, have not been reported in Goa so far. Whatever reactions were seen among the younger population post-vaccination have been mild, like in the case of any other vaccine, and lasted for two to three days,” Kakodkar said.
"
Accenture Q3 revenue grows 21% to $13.3 billion,1739,"BENGALURU: Accenture's revenue grew 21% in its third quarter ended May to $13.3 billion, beating its guidance. The company was helped by robust growth in its healthcare, communications and financial services business. New bookings for the quarter were $15.4 billion, an increase of 39% from a year earlier, with consulting bookings of $8 billion and outsourcing bookings of $7.4 billion.
The strong performance led the company to raise its guidance for the fourth quarter and the full year. In the fourth quarter, the company expects to grow 17-21% in local currency, translating to $13.1-13.5 billion. For the full year, growth is expected to be in the range of 10-11% in local currency, up from 6.5-8.5%. Margin is expected to rise by 40 basis points to 15.1%.

This is a modal window.

No compatible source was found for this media.

“Our outstanding financial results reflect our continued momentum driven by the demand for digital transformation, the depth and breadth of our client relationships with the world’s leading companies, our talented people and the strength of our business across geographic markets, industries and services,” CEO Julie Sweet said.
Both the outsourcing and consulting businesses reported robust numbers, with outsourcing revenue up 21% to $7.2 billion and consulting up 20% to $6 billion.

Indian IT services companies also posted good growth in their last quarter, helped by clients’ rush to digitally transform their businesses using cloud and cyber security services as people continue to work remotely.
Accenture's communications, media & technology business was up 23%, financial services was up 21% and healthcare was up 25%. North America, the company’s biggest market, was up 18% to $6.2 billion.
"
