Title,Publishing Date,Source
Life after the 1918 flu has lessons for our post-pandemic world,"Jun 28, 2021",https://www.cnn.com/2021/06/28/health/changes-after-covid-pandemic-1918-flu-wellness-scn/index.html
Worried about your kid's development? Turn to your doctor before the internet or friends,"Jun 28, 2021",https://www.cnn.com/2021/06/28/health/ask-your-pediatrician-for-help-wellness/index.html
Should you always tell your kids the truth? It depends,"Jun 28, 2021",https://www.cnn.com/2021/06/28/health/truths-lies-parents-wellness/index.html
Dr. Sanjay Gupta: The secrets of a 'Jeopardy!' guest host,"Jun 27, 2021",https://www.cnn.com/2021/06/27/health/jeopardy-host-sanjay-gupta-essay/index.html
"'Step up and get vaccinated': How adults should protect children from Covid-19 variants, expert says","Jun 27, 2021",https://www.cnn.com/2021/06/27/health/us-coronavirus-sunday/index.html
"'Please get your second shot,' top health official urges as Delta variant remains a pressing threat","Jun 26, 2021",https://www.cnn.com/2021/06/26/health/us-coronavirus-saturday/index.html
How the first cruise of the Covid era got ready to safely set sail,"Jun 26, 2021",https://www.cnn.com/2021/06/26/health/cruise-after-covid-health-protocol/index.html
An inside look at how the first Covid-era cruise prepared to set sail,"Jun 26, 2021",https://www.cnn.com/videos/health/2021/06/26/celebrity-cruises-coronavirus-gupta-pkg-vpx.cnn
FDA adds a warning to Covid-19 vaccines about risk of heart inflammation,"Jun 26, 2021",https://www.cnn.com/2021/06/25/health/fda-covid-vaccine-heart-warning/index.html
"Some fully vaccinated people may still get sick if exposed to variants, CDC warns","Jun 25, 2021",https://www.cnn.com/2021/06/25/health/us-coronavirus-friday/index.html
The author of 'White Fragility' takes on 'nice racism',"Jun 26, 2021",https://www.cnn.com/2021/06/26/health/robin-diangelo-nice-racism-blake/index.html
How to create a gender-inclusive environment for our kids,"Jun 26, 2021",https://www.cnn.com/2021/06/26/health/gender-inclusive-environment-children-wellness-opinion/index.html
"East Asia was hit by another coronavirus epidemic 20,000 years ago, new study shows","Jun 26, 2021",https://www.cnn.com/2021/06/25/health/coronavirus-epidemic-east-asia-20000-years-intl-hnk-scn/index.html
CNN Heroes: Confronting the role of race in medicine,"Jun 26, 2021",https://www.cnn.com/videos/health/2021/06/25/philadelphia-black-doctors-covid-19-consortium-questions-cnnheroes.cnn
CNN Heroes: What's in the Covid-19 vaccine?,"Jun 26, 2021",https://www.cnn.com/videos/health/2021/06/25/philadelphia-black-doctors-covid-19-consortium-vaccine-questions-cnnheroes.cnn
Tapper asks Gupta: What are the chances people can still be rescued alive?,"Jun 26, 2021",https://www.cnn.com/videos/health/2021/06/25/sanjay-gupta-condo-collapse-rescue-attempts-lead-vpx.cnn
These beating heart cells went to space. This is how they could save patients,"Jun 26, 2021",https://www.cnn.com/2021/06/25/health/heart-cells-space-scn/index.html
A 'tough nut to crack': States race to vaccinate young adults against Covid-19,"Jun 24, 2021",https://www.cnn.com/2021/06/24/health/genz-not-vaccinated-outreach/index.html
Did Covid-19 take your taste and smell? Here's when they may return,"Jun 25, 2021",https://www.cnn.com/2021/06/25/health/loss-of-taste-smell-covid-19-return-wellness/index.html
Experiencing Hulk rage and terrible sleep? It may be perimenopause — here's what to do,"Jun 25, 2021",https://www.cnn.com/2021/06/25/health/perimenopause-womens-health-wellness/index.html
These are the two key groups now being hit hardest by Covid-19,"Jun 24, 2021",https://www.cnn.com/2021/06/24/health/us-coronavirus-thursday/index.html
This CNN Hero is fighting to save lives in Philadelphia's communities of color through Covid-19 vaccination and testing,"Jun 25, 2021",https://www.cnn.com/2021/06/24/health/philadelphia-black-doctors-covid-19-vaccination-cnnheroes/index.html
Officials blame Delta variant for Covid-19 surge in Missouri,"Jun 25, 2021",https://www.cnn.com/videos/health/2021/06/25/delta-variant-coronavirus-missouri-savidge-dnt-lead-vpx.cnn
More than 1 in 10 people have missed their second dose of Covid-19 vaccine,"Jun 25, 2021",https://www.cnn.com/2021/06/24/health/missed-second-doses-delta/index.html
"US life expectancy fell by more than a year during coronavirus pandemic, research suggests","Jun 24, 2021",https://www.cnn.com/2021/06/24/health/us-life-expectancy-covid-19-pandemic-study-wellness/index.html
Try these 5 ways to practice mindfulness with your kids,"Jun 24, 2021",https://www.cnn.com/2021/06/24/health/kids-mindfulness-5-ways-wellness/index.html
Scientist says early coronavirus samples were deleted from NIH database,"Jun 24, 2021",https://www.cnn.com/2021/06/23/health/coronavirus-sequences-database-scientist/index.html
FDA chief stays mum on plans for banning flavored vapes,"Jun 24, 2021",https://www.cnn.com/2021/06/23/health/house-vaping-fda-hearing/index.html
"Benefits of Covid-19 vaccination clearly outweigh risks of rare heart inflammation, CDC vaccine advisers told","Jun 24, 2021",https://www.cnn.com/2021/06/23/health/myocarditis-covid-vaccines-cdc-acip/index.html
"Nearly every new Covid-19 death is now entirely preventable, CDC director says","Jun 23, 2021",https://www.cnn.com/2021/06/23/health/us-coronavirus-wednesday/index.html
'There is a tsunami coming': Widower warns of Covid 'long haulers' plight,"Jun 24, 2021",https://www.cnn.com/videos/health/2021/06/23/covid-long-hauler-struggle-suicide-mental-health-nick-guthe-intv-nr-vpx.cnn
"Cannabis use may be linked with suicidal thoughts, plans and attempts in young adults, study finds","Jun 24, 2021",https://www.cnn.com/2021/06/23/health/weed-cannabis-suicide-risk-study-wellness/index.html
"US births fell during the pandemic, CDC data show","Jun 23, 2021",https://www.cnn.com/2021/06/23/health/us-births-decline-pandemic-cdc-study-wellness/index.html
Will a Covid-19 vaccine booster be needed later this year?,"Jun 23, 2021",https://www.cnn.com/videos/health/2021/06/23/coronavirus-vaccine-booster-shot-gupta-pkg-newday-vpx.cnn
"As Covid-19 deaths hit record lows, those dying are younger and more disproportionately Black than before","Jun 23, 2021",https://www.cnn.com/2021/06/23/health/covid-deaths-shifting-younger-more-disparities/index.html
How to improve posture and relieve pain with your breath,"Jun 23, 2021",https://www.cnn.com/2021/06/23/health/breathing-pain-relief-posture-movement-wellness/index.html
"First came Covid, then long-haul symptoms. And now they're battling the guilt of having survived it all","Jun 23, 2021",https://www.cnn.com/2021/06/23/health/long-covid-survivors-guilt-wellness/index.html
"More infectious variant now makes up 20% of coronavirus samples tested, Fauci says","Jun 22, 2021",https://www.cnn.com/2021/06/22/health/us-coronavirus-tuesday/index.html
What the Delta variant could mean for Covid-19 in the United States,"Jun 22, 2021",https://www.cnn.com/2021/06/22/health/covid-variant-delta-gamma/index.html
Optimize your breathing with these tips,"Jun 23, 2021",https://www.cnn.com/videos/health/2021/06/18/how-to-improve-your-breathing-lbb-orig.cnn
Parents need to start talking about puberty early,"Jun 22, 2021",https://www.cnn.com/2021/06/22/health/talking-about-puberty-with-kids-wellness/index.html
Transgender children and their parents struggle to cope with restrictive laws,"Jun 14, 2021",https://www.cnn.com/2021/06/14/health/trans-kids-care-state-bans-wellness/index.html
Living with a short sleep gene: 'It's a gift',"Jun 22, 2021",https://www.cnn.com/2021/06/22/health/short-sleep-gene-wellness-scn/index.html
Two people are dead after Covid-19 outbreak hit a government building,"Jun 22, 2021",https://www.cnn.com/videos/health/2021/06/22/manatee-county-government-building-ebof-intv-hopes-sot-vpx.cnn
"Drinking coffee of any type cuts risk for liver problems, study says","Jun 22, 2021",https://www.cnn.com/2021/06/21/health/coffee-benefits-liver-wellness/index.html
International Day of Yoga 2021: Find the path to your well-being,"Jun 21, 2021",https://www.cnn.com/2021/06/21/health/international-day-of-yoga-2021-wellness/index.html
'Let me give you a flash': Hear Dr. Fauci fire back at critics,"Jun 21, 2021",https://www.cnn.com/videos/health/2021/06/21/dr-anthony-fauci-responds-to-critics-nyt-podcast-newday-vpx.cnn
It has been 500 days since the first known US death from Covid-19. Variants and low vaccination rates threaten to prolong the pandemic,"Jun 20, 2021",https://www.cnn.com/2021/06/20/health/us-coronavirus-sunday/index.html
Why becoming a stay-at-home dad was the best decision I ever made,"Jun 20, 2021",https://www.cnn.com/2021/06/20/health/stay-at-home-dads-fathers-day-wellness/index.html
They lost their loved ones to Covid. Then they heard from them again,"Jun 20, 2021",https://www.cnn.com/2021/06/20/health/supernatural-encounters-pandemic-loved-ones-blake/index.html
What to do to stay safe around water this summer at the pool or beach,"Jun 19, 2021",https://www.cnn.com/2021/06/19/health/water-safety-swimming-wellness/index.html
This woman is a chess champion. And she's blind,"Jun 19, 2021",https://www.cnn.com/2021/06/19/health/chess-champion-jessica-lauser-wellness/index.html
Blind chess champion's advice to all,"Jun 19, 2021",https://www.cnn.com/videos/health/2021/06/16/blind-chess-champion-wellness.cnn
"The US marks a vaccine milestone, but one expert warns that the coronavirus Delta variant has a worrying impact on patients","Jun 19, 2021",https://www.cnn.com/2021/06/19/health/us-coronavirus-saturday/index.html
"Delta variant will likely become dominant Covid-19 strain in US, CDC chief says","Jun 18, 2021",https://www.cnn.com/2021/06/18/health/us-coronavirus-friday/index.html
Summer is the season that reminds us to come alive,"Jun 19, 2021",https://www.cnn.com/2021/06/19/health/summer-wisdom-project-wellness/index.html
"Bring the 'dad jokes,' we need 'em. (Warning: This story contains actual dad jokes)","Jun 19, 2021",https://www.cnn.com/2021/06/18/health/go-ask-your-dad-jokes-wellness-parenting/index.html
"It's not just Delta -- other coronavirus variants worry scientists, also","Jun 19, 2021",https://www.cnn.com/2021/06/18/health/gamma-variant-spread/index.html
"As the pandemic in the US slows, the fight against 'long haul' Covid is on","Jun 19, 2021",https://www.cnn.com/2021/06/18/health/long-haul-covid-19-treatments-and-developments/index.html
Scientist with sickle cell fights for a cure,"Jun 18, 2021",https://www.cnn.com/videos/health/2021/06/16/world-sickle-cell-day-donor-cure-wellness.cnn
Sickle cell scientist fights for a cure for herself and others,"Jun 18, 2021",https://www.cnn.com/2021/06/18/health/world-sickle-cell-day-human-factor-wellness/index.html
The struggle to mandate Covid-19 vaccines for health care workers,"Jun 18, 2021",https://www.cnn.com/2021/06/18/health/covid-19-vaccine-mandate-health-care/index.html
"Okay, okra! 5 reasons to love this underrated ingredient","Jun 18, 2021",https://www.cnn.com/2021/06/18/health/how-to-cook-okra-wellness/index.html
"Poor sleep linked to dementia and early death, study finds","Jun 18, 2021",https://www.cnn.com/2021/06/18/health/sleep-dementia-early-death-wellness/index.html
"These communities remain at high risk for dangerous Covid-19 variants rapidly increasing in US, expert warns","Jun 17, 2021",https://www.cnn.com/2021/06/17/health/us-coronavirus-thursday/index.html
"Heart inflammation condition looked like heart attack in kids, pediatrician says","Jun 18, 2021",https://www.cnn.com/2021/06/17/health/myocarditis-boys-heart-attack-covid-wellness/index.html
"If 'cave syndrome' is keeping you from going in public, here's how to combat it","Jun 17, 2021",https://www.cnn.com/2021/06/17/health/cave-syndrome-pandemic-wellness/index.html
West Nile Virus Fast Facts,"Jul 14, 2013",https://www.cnn.com/2013/07/13/health/west-nile-virus-fast-facts/index.html
"Sperm count not harmed by Covid-19 vaccine, study says","Jun 17, 2021",https://www.cnn.com/2021/06/17/health/sperm-count-covid-vaccine-wellness/index.html
Why it's crucial to get kids caught up on their childhood immunizations,"Jun 17, 2021",https://www.cnn.com/2021/06/17/health/child-immunization-schedule-pandemic-wellness/index.html
"Do you yearn for fulfillment? Reach for the 'ordinary,' author says","Jun 16, 2021",https://www.cnn.com/2021/06/16/health/ordinary-fulfillment-rainesford-stauffer-wellness/index.html
This tech uses augmented reality to give surgeons 'superpowers',"Jun 17, 2021",https://www.cnn.com/2021/06/17/health/augmented-surgery-syncar-technology-spc-hnk/index.html
Meet the scientist finding a cure for her own disease,"Jun 17, 2021",https://www.cnn.com/videos/health/2021/06/17/sickle-cell-day-lakiea-bailey-gupta-pkg-newday-vpx.cnn
Former White House adviser says dangerous coronavirus variant is 'like Covid on steroids',"Jun 16, 2021",https://www.cnn.com/2021/06/16/health/us-coronavirus-wednesday/index.html
"CNN analysis: Where vaccination is up, Covid-19 cases are down","Jun 16, 2021",https://www.cnn.com/2021/06/16/health/covid-cases-vaccinations-trends-analysis/index.html
Afghan dog rescue group dismayed by CDC import ban,"Jun 16, 2021",https://www.cnn.com/2021/06/16/health/rabies-cdc-afghan-rescue-nowzad-wellness/index.html
Breathe better to live better: Why breathing is your superpower,"Jun 16, 2021",https://www.cnn.com/2021/06/16/health/breathing-better-training-wellness/index.html
Pediatricians work to close gaps in Covid-19 vaccine coverage by vaccinating adults,"Jun 16, 2021",https://www.cnn.com/2021/06/15/health/pediatricians-vaccinating-adults/index.html
This 90-second deep breathing exercise will help relieve stress,"Jun 4, 2021",https://www.cnn.com/videos/health/2021/06/01/deep-breathing-exercises-for-stress-lbb-orig.cnn
"Makeup may contain potentially toxic chemicals called PFAS, study finds","Jun 15, 2021",https://www.cnn.com/2021/06/15/health/makeup-toxic-chemicals-wellness/index.html
New York reaches vaccine milestone and joins California in reopening,"Jun 15, 2021",https://www.cnn.com/2021/06/15/health/us-coronavirus-tuesday/index.html
CDC now calls coronavirus Delta variant a 'variant of concern',"Jun 15, 2021",https://www.cnn.com/2021/06/15/health/delta-variant-of-concern-cdc-coronavirus/index.html
How 'alloparenting' can be a less isolating way to raise kids,"Jun 15, 2021",https://www.cnn.com/2021/06/15/health/alloparenting-multiple-caregivers-raising-kids-wellness/index.html
NIH researchers find more evidence Covid was circulating in the US in December 2019,"Jun 15, 2021",https://www.cnn.com/2021/06/15/health/coronavirus-all-of-us-blood-survey/index.html
NIH researchers find more evidence Covid was circulating in the US in December 2019,"Jun 15, 2021",https://www.cnn.com/2021/06/15/health/coronavirus-all-of-us-blood-survey/index.html
"Children who eat more ultra-processed food gain weight more quickly, study suggests","Jun 15, 2021",https://www.cnn.com/2021/06/15/health/ultra-processed-food-kids-diet-wellness/index.html
Here's why you hate the sound of your own voice,"Jun 15, 2021",https://www.cnn.com/2021/06/15/health/voice-recording-wellness-partner/index.html
A new coronavirus variant is on the rise. Here's why experts are concerned,"Jun 14, 2021",https://www.cnn.com/2021/06/14/health/us-coronavirus-monday/index.html
"US to pass 600,000 Covid-19 deaths","Jun 15, 2021",https://www.cnn.com/videos/health/2021/06/14/delta-variant-covid-19-deaths-watt-wrap-lead-vpx.cnn
"Organ transplant patients may benefit from third Covid-19 vaccine dose to boost antibodies, study suggests","Jun 15, 2021",https://www.cnn.com/2021/06/14/health/organ-transplant-covid-vaccine-study-wellness/index.html
CDC suspends import of dogs from countries with high rabies risk,"Jun 15, 2021",https://www.cnn.com/2021/06/14/health/dogs-cdc-rabies-import/index.html
Toxic chemical 'Hall of Shame' calls out major retailers for failing to act,"Mar 30, 2021",https://www.cnn.com/2021/03/30/health/shopping-toxic-chemicals-wellness/index.html
Creating a stress-free divorce for your kid -- or getting as close as you can,"Jun 13, 2021",https://www.cnn.com/2021/06/13/health/good-divorce-wellness/index.html
Novavax says Covid-19 vaccine shows 90.4% overall efficacy in US/Mexico Phase 3 trial,"Jun 14, 2021",https://www.cnn.com/2021/06/14/health/novavax-covid-19-vaccine-us-phase-3-trial-study/index.html
"Have suitcase, will travel! Americans take to the skies in almost pre-pandemic numbers as Covid-19 restrictions ease","Jun 13, 2021",https://www.cnn.com/2021/06/13/health/us-coronavirus-sunday/index.html
Pediatric cardiologists explain myocarditis and why your teen should still get a Covid-19 vaccine,"Jun 13, 2021",https://www.cnn.com/2021/06/13/health/myocarditis-covid-vaccine-questions-answers/index.html
Less than half the adults in five US states have received their first Covid-19 vaccine dose,"Jun 12, 2021",https://www.cnn.com/2021/06/12/health/us-coronavirus-saturday/index.html
Vaccination rates lag in some states as more cities reopen,"Jun 12, 2021",https://www.cnn.com/videos/health/2021/06/12/us-covid-19-vaccination-rates-falling-as-country-reopens-for-summer-sandoval-vpx.cnn
"Dangerous Covid variants could set back national progress against the pandemic, officials warn","Jun 11, 2021",https://www.cnn.com/2021/06/11/health/us-coronavirus-friday/index.html
Doctor says FDA decision was so egregious he resigned,"Jun 12, 2021",https://www.cnn.com/videos/health/2021/06/11/dr-joel-perlmutter-intv-fda-advisor-resign-alzheimers-aducanumab-sot-nr-vpx.cnn
This skateboarder is helping plus-size riders roll,"Jun 11, 2021",https://www.cnn.com/2021/06/11/health/human-factor-andy-duran-chub-rollz-overweight-skate-club-wellness/index.html
"Suicide attempts rose among adolescent girls during pandemic, ER data suggest","Jun 11, 2021",https://www.cnn.com/2021/06/11/health/suicide-attempts-teen-girls-cdc-study-wellness/index.html
Garlic facts and history: The truth about vampires and health benefits,"Jun 11, 2021",https://www.cnn.com/2021/06/11/health/garlic-facts-history-wellness/index.html
"States are scaling back on reporting Covid-19 data, but some experts say it's too soon","Jun 11, 2021",https://www.cnn.com/2021/06/11/health/states-scale-back-covid-data-reporting/index.html
"Alcohol beverage companies made an estimated $17.5 billion on underage drinking in 2016, study says","Jun 11, 2021",https://www.cnn.com/2021/06/11/health/alcohol-sales-to-minors-wellness/index.html
Chinese researchers find batch of new coronaviruses in bats,"Jun 11, 2021",https://www.cnn.com/2021/06/10/health/bats-coronavirus-china-genome/index.html
CDC says fully vaccinated people don't have to wear masks in open-air areas of public transit or at outdoor sections of hubs,"Jun 10, 2021",https://www.cnn.com/2021/06/10/health/us-coronavirus-thursday/index.html
FDA's vaccine advisers debate urgency of vaccinating kids against coronavirus,"Jun 11, 2021",https://www.cnn.com/2021/06/10/health/fda-advisers-covid-vaccines-kids/index.html
CDC warns about spike in RSV cases across South,"Jun 11, 2021",https://www.cnn.com/2021/06/10/health/rsv-cdc-warning/index.html
What we know about the Covid-19 Delta variant first found in India,"Jun 11, 2021",https://www.cnn.com/2021/06/10/health/delta-variant-india-explained-coronavirus-intl-cmd/index.html
Uncovering the origins of the virus that sparked a pandemic,"Jun 11, 2021",https://www.cnn.com/2021/06/10/health/coronavirus-origin-natural-spillover-lab-leak-gupta/index.html
"As some doses approach expiration, FDA extends shelf life for Johnson & Johnson vaccine","Jun 10, 2021",https://www.cnn.com/2021/06/10/health/johnson-johnson-vaccine-expiration-extended/index.html
Skipping a trip to the grocery store may lead to fewer junk food purchases,"Jun 10, 2021",https://www.cnn.com/2021/06/10/health/healthy-eating-online-shopping-study-wellness/index.html
Moderna seeks FDA authorization for Covid-19 vaccine for people ages 12 to 17,"Jun 10, 2021",https://www.cnn.com/2021/06/10/health/moderna-vaccine-adolescent-eua-appligation/index.html
"Are you a night owl or morning lark? One may protect you from depression, study says","Jun 8, 2021",https://www.cnn.com/2021/06/07/health/night-owl-depression-link-wellness/index.html
Join the jump rope craze and burn more calories than jogging,"Jun 6, 2021",https://www.cnn.com/2021/06/06/health/jump-rope-fitness-trend-instagram-trnd-wellness/index.html
Can indoor concerts ever be safe again?,"Jun 10, 2021",https://www.cnn.com/2021/06/10/health/covid-indoor-concerts-wellness/index.html
A link between Covid-19 vaccination and a cardiac illness may be getting clearer,"Jun 9, 2021",https://www.cnn.com/2021/06/09/health/myocarditis-covid-vaccination-link-clearer/index.html
Work can wait. Your mental health can't. How to make the most of a break,"Jun 10, 2021",https://www.cnn.com/2021/06/10/health/work-break-mental-health-wellness/index.html
"New Alzheimer's drug aducanumab: cost, side effects, timeline and other questions answered","Jun 10, 2021",https://www.cnn.com/2021/06/09/health/aducanumab-questions-answered-wellness/index.html
FDA adviser resigns over approval of new Alzheimer's drug,"Jun 10, 2021",https://www.cnn.com/2021/06/10/health/fda-adviser-resigns-alzheimers/index.html
Modified mosquitoes reduce dengue cases by 77% in Indonesia experiment,"Jun 10, 2021",https://www.cnn.com/2021/06/10/health/dengue-modified-mosquitoes-indonesia-intl/index.html
How do you navigate risk in the pandemic? This poker expert tells all,"Jun 8, 2021",https://www.cnn.com/2021/06/08/health/poker-risk-pandemic-maria-konnikova-wellness/index.html
"Use of neck restraints by law enforcement should be prohibited, American Academy of Neurology says","Jun 10, 2021",https://www.cnn.com/2021/06/10/health/american-academy-of-neurology-neck-restraints/index.html
States begin scaling back daily Covid-19 data reporting as federal officials try to vaccinate more Americans,"Jun 9, 2021",https://www.cnn.com/2021/06/09/health/us-coronavirus-wednesday/index.html
US intelligence working on report about Covid-19 origins,"Jun 10, 2021",https://www.cnn.com/videos/health/2021/06/10/coronavirus-pandemic-origins-gupta-pkg-ac360-vpx.cnn
J&J says it's working to extend the shelf-life of its Covid-19 vaccine so doses don't expire,"Jun 9, 2021",https://www.cnn.com/2021/06/09/health/johnson-vaccine-expiration/index.html
Tapper and Gupta react to doctor's unhinged vaccine claim,"Jun 10, 2021",https://www.cnn.com/videos/health/2021/06/09/sherri-tenpenny-ohio-false-vaccine-claim-lead-vpx.cnn
From 'geriatric pregnancy' to '35+ pregnancy:' There's a better way to talk to pregnant people,"Jun 8, 2021",https://www.cnn.com/2021/06/08/health/pregnant-less-offensive-language-wellness/index.html
Dr. Fauci: We can't declare victory too prematurely,"Jun 9, 2021",https://www.cnn.com/videos/health/2021/06/09/fauci-coronavirus-delta-variant-sot-vpx.cnn
The coming flu season may be severe. Here's why,"Jun 9, 2021",https://www.cnn.com/2021/06/08/health/influenza-season-doozy/index.html
Beech-Nut to stop selling baby rice cereal after finding high arsenic levels,"Jun 9, 2021",https://www.cnn.com/2021/06/09/health/beech-nut-baby-food-recall-wellness/index.html
Ebola Fast Facts,"Apr 12, 2014",https://www.cnn.com/2014/04/11/health/ebola-fast-facts/index.html
FDA's vaccine advisers to discuss rules for authorizing Covid-19 shots for kids,"Jun 9, 2021",https://www.cnn.com/2021/06/09/health/fda-vrbpac-covid-shots-kids/index.html
What should vaccinated parents with unvaccinated kids do?,"Jun 9, 2021",https://www.cnn.com/2021/06/09/health/vaccinated-parents-unvaccinated-children-wellness/index.html
5 signs your workouts are working that have nothing to do with a scale,"Jun 9, 2021",https://www.cnn.com/2021/06/09/health/non-scale-victories-weight-loss-fitness-wellness/index.html
7 hopeful signs the US is moving past the worst of the pandemic,"Jun 8, 2021",https://www.cnn.com/2021/06/08/health/covid-19-pandemic-getting-better/index.html
CEPI CEO: Share vaccine doses now,"Jun 8, 2021",https://www.cnn.com/videos/health/2021/06/08/richard-hatchett-cepi-covid-g7-vaccine.cnn
Dr. Gupta: How to assess risk when going mask-free,"Jun 8, 2021",https://www.cnn.com/2021/06/08/health/coronavirus-cdc-mask-risk-gupta/index.html
'American tragedy': Fauci on not making use of vaccines in US,"Jun 5, 2021",https://www.cnn.com/videos/health/2021/06/04/fauci-american-tragedy-vaccines-sot-vpx.made-to-save-covid-19-community-corps
How a 'micro-practice' can ease stress and help you sleep,"Jun 8, 2021",https://www.cnn.com/2021/06/08/health/one-minute-breathing-meditation-wellness/index.html
MRSA Fast Facts,"Jun 28, 2013",https://www.cnn.com/2013/06/28/us/mrsa-fast-facts/index.html
Mindfulness coach: Do this when dealing with anxiety,"Feb 4, 2021",https://www.cnn.com/videos/health/2021/02/04/mental-health-mindfulness-during-pandemic-ctw-vpx.cnn
"People with diabetes who sleep badly are at greater risk of dying prematurely, study suggests","Jun 8, 2021",https://www.cnn.com/2021/06/08/health/diabetes-sleep-problems-wellness/index.html
Why face-to-face gatherings still matter,"Jun 7, 2021",https://www.cnn.com/2021/06/07/health/face-to-face-brain-wellness-scn/index.html
CDC study finds coronavirus vaccines lead to milder disease in rare breakthrough infections,"Jun 7, 2021",https://www.cnn.com/2021/06/07/health/us-coronavirus-monday/index.html
"In controversial decision, FDA approves first new Alzheimer's disease drug in nearly 20 years","Jun 7, 2021",https://www.cnn.com/2021/06/07/health/alzheimers-drug-aducanumab-fda-approved-wellness/index.html
Why the newest Alzheimer's drug is controversial,"Jun 8, 2021",https://www.cnn.com/videos/health/2021/06/07/alzheimers-drug-aducanumab-fda-approved-controversy-cohen-nr-vpx.cnn
Why you should actually break for lunch,"Jun 7, 2021",https://www.cnn.com/2021/06/07/health/skipping-lunch-wellness/index.html
