Title,Len,Content,Publishing Date
"Doctors, hospitals take up arms against Democrats' health care changes",9206,"WASHINGTON — Across months of debates, stump speeches, TV appearances and position papers, the face of everything wrong with the U.S. health care industry for Democratic candidates has mostly come down to two groups: private insurers and pharmaceutical companies. But in focusing on those industries, candidates may be leaving supporters unprepared for the fight it would take to pass ""Medicare for All"" or create a public insurance option. In fact, Democratic proposals already face opposition from well-funded groups representing doctors, specialists and hospitals, many of which would be asked to accept major revenue cuts to finance expanded coverage. While Democrats are comfortable attacking bureaucrats, chief executives and Big Pharma, public campaigns to block legislation are likely to include more sympathetic figures from voters' communities like Dr. Asim Shah, executive vice chairman and professor of psychiatry at Baylor College of Medicine. Shah, who oversees about 90 staff members at a trauma center in Houston and is known locally for his work treating survivors of Hurricane Harvey, co-wrote an op-ed in The Houston Chronicle last month warning of ""the perils of dismantling the existing structures and moving directly to a government-run plan."" Shah told NBC News that he's not ideologically opposed to a government-led approach but that he's concerned with a simple reality: Medicare pays providers less than private insurance, and almost every 2020 Democratic plan looks to bring down soaring costs by tying more coverage to Medicare. ""Their reimbursement rates are not high,"" he said. ""That's the reason some are scared."" The gap is especially large at hospitals, where an analysis by Rand Health Care found that private insurers pay more than twice as much on average for similar care. The ""Medicare for All"" plan put forth by Sen. Elizabeth Warren of Massachusetts, a Democratic presidential candidate, anticipates lowering health care spending by trillions of dollars by moving physicians to Medicare rates, reimbursing hospitals at an average of 110 percent of Medicare rates and instituting reforms that would cap the growth of health care costs moving forward. Single-payer advocates argue that doing away with private insurance would reduce administrative burdens for doctors and hospitals, meaning they would be able to treat more patients for less. The United States is a major outlier among developed countries when it comes to its high health care costs, and some outside analyses of ""Medicare for All"" proposals suggest that they could produce significant savings by negotiating lower prices and cutting overhead. Donald Berwick, who oversaw Medicare and Medicaid under President Barack Obama and consulted on Warren's plan, said her reimbursement rates were calculated to cover current operating margins for hospitals but would make it harder for them to bargain for higher rates in the future. ""It's definitely stringent, and it would really require hospitals to look very carefully inside for efficiencies, but they should be doing that, anyway,"" Berwick said. Rival approaches short of the ""Medicare for All"" proposals by Warren and Sen. Bernie Sanders of Vermont, another Democratic presidential candidate, would also require new savings from health care providers. Many candidates are proposing a public insurance option that would pay some variation on Medicare rates in part to pressure private insurers to compete with lower premiums and spur providers to lower their prices. South Bend, Ind., Mayor Pete Buttigieg has proposed limiting how much hospitals could charge private insurers relative to Medicare. In a preview of the fight, Congress is struggling to advance legislation to address the sometimes shockingly high and confusing out-of-network hospital bills that patients receive — a much less daunting issue with bipartisan interest, including from the White House — amid an onslaught of outside spending. A new group called Doctor Patient Unity popped up in July and spent over $28 million on ads opposing it through the summer, more than Warren's presidential campaign raised in the last quarter. Its funders were initially unclear, but The New York Times revealed that they were private-equity companies invested in health care. Industry groups opposing ""Medicare for All"" are making the case that they need higher private insurance rates to make up for lower government rates and that customers would suffer from any reductions. The American Hospital Association decried Warren's proposal, arguing that ""hospitals are already paid far less than the cost of caring for Medicare patients"" and that further cuts ""could threaten access to care and hospitals' survival."" Partnership for America's Health Care Future, an umbrella group of health care trade groups that oppose single-payer health care or a public option, has commissioned outside studies raising concerns about the impact of lower reimbursement rates on hospitals struggling with revenue. ""If you assume and put all the population onto Medicare under current reimbursement rates or create a public option that shifts people to current reimbursement rates, you would find the current system we have today in our hospitals would not be able to continue to function,"" Lauren Crawford Shaver, the group's executive director, said in an interview. The crucial fight has been almost entirely overshadowed in the 2020 contest by arguments over replacing existing private insurance with a government plan. To the extent that health care providers have come up, they've often been cast as heroes held back by the existing system. ""People don't like their private insurance companies. They like their doctors and hospitals,"" Sanders said during the first Democratic debate. ""We will substantially lower the cost of health care in this country because we will stop the greed of the insurance companies and the drug companies."" A rare exception came in the same debate, when former Rep. John Delaney of Maryland, a former health care executive, warned that single-payer plans would lead to hospital closings or reductions in staff. ""They're going to move everyone to a government payment system and then realize they'll have to raise rates,"" Delaney told NBC News. ""We could have a lower-cost health care system, but it would probably come with limitations on access and limitations on quality."" Celinda Lake, a Democratic pollster, said that voters are receptive to the notion that segments of the industry are gouging customers but that candidates need to be careful in framing the debate. ""People have mixed views about hospitals. It depends on how they get positioned,"" she said. ""If you say 'the for-profit health care industry,' that's a negative frame that can include hospitals and specialists. If it's your family doctor, that's pretty problematic."" The debate over Medicare payments is more complicated than a simple across-the-board cut. The new system could also boost compensation for many doctors and hospitals, creating winners and losers and a scramble of industry lobbying to be on the right side of the equation. Hospitals with many patients who are uninsured or on Medicaid, which pays lower rates than Medicare, could benefit from the change. Warren's plan proposes raising Medicare payments for primary care doctors and cutting them for specialists, who some health care experts argue have too much leverage in price negotiations. The American Medical Association, or AMA, the top industry lobbying group for doctors, opposes ""Medicare for All,"" but its members are closely divided on the issue, and they nearly voted to change their position in August. The AMA withdrew from Partnership for America's Health Care Future shortly afterward. ""Nobody is soaking the doctors or the hospitals,"" said Dr. Steffie Woolhandler, co-founder of Physicians for a National Health Care Program, which advocates for a single-payer system. ""It doesn't mean you won't get people who feel they would be less profitable and make less money under the new system."" Grumbling by individual industry players could potentially be solved by raising rates or backing off proposed reforms. Under Obama, for example, Democrats held off on aggressive changes to drug companies in the Affordable Care Act and instead cut a deal to neutralize one major industry threat while imposing bigger changes on others. Legislators in Washington state created a public insurance option this year but set its reimbursement rates at 160 percent of Medicare, only a modest drop from private insurance, to address concerns from health care providers. But finding a politically and technically workable way to finance the more expansive ""Medicare for All"" is difficult. Backing off on cost-cutting measures could raise the price tag by trillions of dollars, making it hard to appease any one group with a quick fix. ""Warren saying everyone has to take a hit is probably the right thing,"" Dr. Stephen Klasko, chief executive of Jefferson Health, a prominent health system in Pennsylvania and New Jersey, told NBC News. ""How the public accepts it, how it gets done and what it does for the country hasn't been articulated yet.""","Nov. 11, 2019"
Celebrity Chef Kathleen Daelemans to Guest Judge Association for Healthcare Foodservice Culinary Competition,3298,"LOUISVILLE, Ky., April 8, 2011 (GLOBE NEWSWIRE) -- Top culinary professionals from the healthcare industry will compete in the Association for Healthcare Foodservice (AHF) 2011 Culinary Competition held in conjunction with its annual conference in Phoenix, on June 7 at the Arizona Biltmore. Five competing teams will demonstrate their exceptional culinary talent and creativity, representative of the healthcare industry. Each team will have the challenge to utilize two ingredients provided by conference sponsor Tyson™ Food Service and create an appealing and nutritious entrée complete with side dishes, sauces and garnishes. ""The culinary competition is an AHF signature event and it is always thrilling to see innovative and delicious meals from self-operated healthcare representing facilities across the country,"" said AHF President Denisa Cate. ""(AHF) nurtures the spirit of the best and brightest culinary talent and we are excited to provide an opportunity to showcase our superstars alongside this year's special guest judge Celebrity Chef Kathleen Daelemans, author, host and speaker."" Kathleen Daelemans Host of ""Cooking Thin"" on Food Network, author of ""Cooking Thin with Chef Kathleen, 200 Easy Recipes for Healthy Weight Loss"" and ""Getting Thin and Loving Food, 200 Easy Recipes to Take You Where You Want to Be!"" said ""It is truly my pleasure to participate in an event that raises the bar for healthcare foodservice.  AHF's culinary competition is a perfect illustration of healthcare foodservice having a positive impact and making a statement about the entire facility."" Each of the five selected culinary teams will be composed of a healthcare chef and their facility director. The actual competition has a format similar to Food Network challenges. There is a time limit of 75 minutes to prepare, cook and present the entrée and sides. The winning dish must fit within the stated nutritional guidelines — cost under $5 to produce, and of course be delicious. These teams and their dishes will be judged on use of texture and color; originality; and plate presentation. The top three winners will be awarded prizes by Tyson™ Food Service and medals from AHF. Friday April 8 is the deadline to become one of the final competing teams in Phoenix. A prospective team must complete the entry form for the competition. (Applications can be found at .) Illustrating creative and cutting-edge cuisine representative of healthcare facilities of today are 2010 competition winners Mary Jaskowski, director nutrition services and Executive Chef Bill Read from St. Mary's Health Care in Grand Rapids, Michigan. The winning dish from Bill and Mary was Pecan Goat Cheese Chicken and Cinnamon Bread Pudding. Catch video highlights from AHF's 2010 Culinary Competition on the AHF YouTube Channel About AHF: The Association for Healthcare Foodservice (AHF) is the national professional association dedicated to advancing self-operated healthcare foodservice as industry best practice. AHF develops healthcare foodservice professionals, assuring food and nutrition services are valued as an essential contributor to the healthcare organization's mission. For more information, please visit: . # # # This information was brought to you by Cision
 The following files are available for download:","April 8, 2011"
6 ways to help health care workers during coronavirus pandemic,4385,"Sometimes the helpers need help, too. As doctors, nurses and other health care personnel work tirelessly across the country during the coronavirus pandemic, there are ways for everyone to show support for all their hard work. With the number of cases crossing 200,000 worldwide on Wednesday and hospitals in places like Italy stretched to the brink, health care workers have been on the front lines treating coronavirus patients and promoting ways to help slow the spread of the illness. Here are some things you can do to show appreciation for their efforts and help ease some of the burden that health care professionals have shouldered. Uber and Sweetgreen have both announced plans to offer free meals to health care workers and first responders in the coming days. Sweetgreen, a salad-based fast-casual chain, also provided a way for people to make sure their local hospital becomes part of the program to receive some healthy meals when they get a break. People who may be friends or family with health care workers could also have a free meal delivered to them by using UberEats, Postmates or another delivery service. The American Red Cross announced it's experiencing a ""severe blood shortage"" because many blood donation drives have been cancelled or postponed due to the coronavirus. Dr. Jerome Adams, the U.S. Surgeon General, emphasized on TODAY Wednesday that people can still take time out to donate blood while maintaining self-quarantine. ""Another important point, you can still go out and give blood,"" James said. ""We're worried about potential blood shortages in the future. Social distancing does not have to mean social disengagement."" You can donate to your local hospital or to organizations like the Center for Disaster Philanthropy, which has created a COVID-19 Response Fund to support those affected by coronavirus as well as first responders. If you are looking to help hospitals with supplies, Direct Relief is helping to provide essential medical items and protective equipment to health care workers responding to the coronavirus. Adams also noted on TODAY that Americans simply following the advice of health care experts can have the biggest impact of all. ""What the American people can do is really drive down that demand by staying at home, washing your hands, social distancing,'' Adams said. Getting your information from credible sources like the Centers for Disease Control and Prevention and the World Health Organization also can help stop the spread of rumors and myths about the illness. If you think you may have coronavirus, these are the important steps you should take, including calling your medical provider first before going to a doctor's office or hospital for treatment. Here are some additional tips on how to protect yourself and your family, properly clean your home and shop for groceries while staying safe. NBC News investigative and consumer correspondent Vicky Nguyen, whose husband is a front line health care worker, summed it up on TODAY Wednesday. ""They are public servants in the highest sense and we can't show them enough of our gratitude,"" she said. ""I feel like there's no better time to shout out these health care workers than in this moment,'' Hoda Kotb added. Citizens of the Italian city of Milan even came together to shower health care workers with applause and a serenade this week in honor of their work. Health care workers with spouses and children are risking their own health to treat others, even if it means being isolated from their own families. Nguyen said her husband has a room designated in their home for isolation if he gets sick, and spouses of health care workers have shared the impact fighting the virus has had on their own families. The hashtag #GetMePPE trended on Twitter as nurses, doctors and other health care workers begged to get more personal protective equipment like N95 masks, respirators and goggles after experiencing shortages of vital items. Panic buying by the public has had some hospitals scrambling to find crucial supplies. ""This is what we were warning people about for weeks,'' Nguyen said on TODAY. ""Please don't go run out and buy the N95 mask. Unless you're on the front lines you don't really need that."" And it potentially could get worse. ""If our curve goes the way of Italy, then there is every chance that we could run out of devices,"" Adams said on TODAY.","March 19, 2020"
Is healthcare forgetting the elderly?,7987,"Ageism is defined as prejudice or discrimination against a particular age group, especially the elderly. The term was first used more than 30 years ago by Dr. Robert N. Butler, the founding Director of the National Institute on Aging, to describe discrimination against the elderly within our healthcare system. But has there been improvement in the healthcare system’s treatment of the elderly population in the last three decades?  Does our healthcare system discriminate against the age group that needs it the most?
Many believe that the lack of training in geriatric medicine is the root of the problem. Often healthcare professionals, because of lack of proper training, make mistaken assumptions or have incorrect beliefs about the type of treatment an elderly patient can endure. Moreover, many doctors feel intense pressure from Medicare, managed care plans, and insurance companies, and try to pack a maximum number of appointments into a day. They may not have the time and training to adequately assess the needs and problems of older patients. To illustrate, a recent survey of students at John Hopkins University School of Medicine, one of the premier medical institutions in the country, showed that 80 percent would admit a 10-year-old girl with pneumonia to intensive care and treat her aggressively, but only 56 percent said they would do the same for an 85-year-old woman. Exacerbating the problem, of course, is that a lack of training in the special needs of elderly patients may be a matter of life and death in many cases.  Finally, many healthcare providers conclude that serious medical problems in elderly patients are simply a matter of getting old. That attitude may result in healthcare providers missing out on opportunities to prevent, treat and enhance the lives of many elderly patients. This problem costs society greatly
By ignoring the medical needs of the elderly, society is impacted greatly. For example, experts say that poor medical attention received by many older Americans leads to premature dependency on government subsidies or on family members who are not prepared for these additional responsibilities. Certainly such discrimination leads to increased levels of mortality and disability, but equally important is the depression and isolation that many older Americans feel when they are deprived of their ability to work, act independently, and to simply enjoy their later years.  Future generations, however, will feel the impact of improper medical care for elderly patients today. For instance, when it is believed that nothing can be done for elderly patients, research is neglected; yet when one recognizes a medical problem, research is enhanced, which obviously has a positive effect in the future.  But an even more startling statistic should alert everyone to the problem: in 2011, the Baby Boom generation will begin to turn 65. While people over 65 made up only 13 percent of the population in 2000, it is projected that by 2030, 20 percent of the population will be age 65 or older. Moreover, the total population over 65 is expected to double in the next 30 years, growing to 70 million people. Obviously, unless attitudes change a large number of people will begin to be directly affected by ageism. Discrimination starts on the preventative level
Discrimination starts on the preventative level. Often older people are denied the kind of preventative care routinely provided to others. Although lack of awareness on the part of both physicians and patients plays a significant role in the disparity of preventative screening measures administered to older patients, findings show that doctors are less aggressive when recommending preventative measures to the elderly. For example, despite the fact that 60 percent of all cancer deaths and 80 percent of all fatal heart attacks afflict men and women age 65 and older, nine out of every ten adults over the age of 65 go without the appropriate screenings according to a 2003 Centers for Disease Control report entitled “Healthy Aging for Older Adults.” Other signs of discrimination
It appears that older people are less likely to be screened for life-threatening diseases than younger people. Studies show that a wide range of diseases and conditions often go unscreened and undetected, including glaucoma, basic cancer tests like pap smears or mammograms, osteoporosis, and even hearing loss. In addition, the mental health of the elderly is often overlooked. Primary care doctors often miss signs of clinical depression and suicidal thoughts in older people (despite the fact that people over 65 had the highest suicide rate of any age group).  Older people are improperly treated routinely by healthcare professionals who have little or no geriatric training. Without casting blame on the system, doctors, often out of ignorance or unconscious bias, may discount or misattribute certain problems to natural aging rather than disease.  In addition, proven medical interventions for older people are often ignored, leading to inappropriate or incomplete treatment. This problem is particularly true as it relates to chemotherapy to be given to elderly cancer patients. It is commonly believed that elderly patients cannot tolerate chemotherapy, yet recent studies show that they can. Finally, older people are consistently underrepresented in clinical trials, a particularly troubling situation because many of the drugs or procedures that are being tested will be used by elderly patients, who comprise the largest segment of the population getting the diseases. Preventing discrimination: Ask questions.
Come to the doctor with a list of questions and concerns on paper. Try to visit the doctor with another person so that two sets of ears will hear the responses to the questions. If you cannot attend with another person, tape record the conversation with your doctor so that you can listen to his or her answers later. Give Complete Information.
Be sure to give your doctor or other healthcare professional complete information when you visit. Don’t hold back because you believe information is unimportant or trivial — let the doctor decide what’s important. Only with complete information can the doctor give a proper diagnosis and prescribe treatment or drugs to treat your problem. Gather Information.
Get as much information as you can from your doctor. Try to understand what he or she believes your problem to be and how it will be treated. Also, don’t neglect the Internet, which can be a fertile source of medical information. Understand as much as you can about your problem so that you can assist in your treatment. Contact Others.
Don’t neglect to contact nurses, pharmacists, social workers and dieticians. They are important to your understanding of the treatment or the drugs you are taking, what social systems are available to help you in your time of need, and how to plan meals that will best serve you while you are undergoing treatment. Advocate with respect.
Healthcare professionals have the medical expertise, but the service, attention and quality of care required doesn’t always come automatically. You or your loved one must often take an active role in getting the best service possible — but you must advocate with respect.  Remember that the doctor or nurse is often under a great deal of pressure and while your concerns are the most important to you, the doctor or nurse has the broader responsibility of attending to the care of many other patients.  Help is available: AARP has a wealth of information on this subject. Contact the AARP at http://www.aarp.org/, or call 800-424-3410. Contact the Alliance for Aging Research, which has studied these issues, at http://www.agingresearch.org/, or call 202-293-2856. Contact the National Institute on Aging at http://www.nia.nih.gov/, or call 301-496-1752. Alan Kopit is a consumer attorney with the firm Hahn Loeser and Parks LLP in Cleveland, Ohio and a regular contributor to “Today.” ","Jan. 22, 2004"
